"Automatic UPDRS Evaluation in the Sit-to-Stand Task of Parkinsonians: Kinematic Analysis and Comparative Outlook on the Leg Agility Task","M. Giuberti; G. Ferrari; L. Contin; V. Cimolin; C. Azzaro; G. Albani; A. Mauro","Xsens Technologies B.V., Enschede, AN, The Netherlands; CNIT Research Unit of Parma and the Department of Information Engineering, University of Parma, Parma, Italy; Research & Prototyping, Telecom Italia, Turin, Italy; Department of Electronics, Information, and Bioengineering, Polytechnic of Milan, Milan, Italy; Division of Neurology and Neurorehabilitation, Istituto Auxologico Italiano IRCCS, Piancavallo (VB), Italy; Division of Neurology and Neurorehabilitation, Istituto Auxologico Italiano IRCCS, Piancavallo (VB), Italy; Department of Neurosciences, University of Turin, Turin, Italy",IEEE Journal of Biomedical and Health Informatics,"20 May 2017","2015","19","3","803","814","In this study, we first characterize the sit-to-stand (S2S) task, which contributes to the evaluation of the degree of severity of the Parkinson's disease (PD), through kinematic features, which are then linked to the Unified Parkinson's disease rating scale (UPDRS) scores. We propose to use a single body-worn wireless inertial node placed on the chest of a patient. The experimental investigation is carried out considering 24 PD patients, comparing the obtained results directly with the kinematic characterization of the leg agility (LA) task performed by the same set of patients. We show that i) the S2S and LA tasks are rather unrelated and ii) the UPDRS distributions (for both S2S and LA tasks) across the patients have a direct impact on the observed system performance.","2168-2208","","10.1109/JBHI.2015.2425296","Italian Ministry of Health(grant numbers:RF-2009-1472190); ","https://ieeexplore.ieee.org/stamp/stamp.jsp?arnumber=7091866","Sit-to-Stand;Leg Agility;UPDRS scores;Parkinson’s Disease;inertial sensors;Inertial sensors;leg agility (LA);Parkinson's disease (PD);sit-to-stand (S2S);unified Parkinson's disease rating scale (UPDRS) scores","Kinematics;Principal component analysis;Informatics;Electronic mail;Support vector machines;Sensors;Feature extraction","Adult;Aged;Biomechanical Phenomena;Female;Humans;Leg;Male;Middle Aged;Monitoring, Physiologic;Parkinson Disease;Severity of Illness Index;Signal Processing, Computer-Assisted;Wireless Technology","23","4","32","IEEE","22 Apr 2015","","","IEEE","IEEE Journals"
"Parkinson Disease Identification Using Hand Written Images","Priya; H. T; J. P; R. S","PSG College of Technology, Coimbatore; Final Year B. Tech Information Technology, PSG College of Technology, Coimbatore; Final Year B. Tech Information Technology, PSG College of Technology, Coimbatore; Final Year B. Tech Information Technology, PSG College of Technology, Coimbatore","2023 International Conference on Intelligent Systems for Communication, IoT and Security (ICISCoIS)","19 Apr 2023","2023","","","37","43","Parkinson's disease is a brain disorder that causes unintended or uncontrollable movements, such as shaking, stiffness, and difficulty with balance and coordination. There's no way to cure or stop the progression of Parkinson's disease. But the recognition of this disease in the early stage can help us in some way. However, the existing algorithms such as SVM used foot sensor data from a person and thereby classifying them as normal or abnormal condition. We have used image and text data together for predicting the Parkinson disease. Our objective is to train a predictive model for detection of Parkinson disease by analyzing the drawn diagrams and voice features of human (both affected and not affected). For that we used the image based data set and text data for voice features. Then we are going to apply CNN and fully connected neural network for generating a hybrid mode. Once the model is trained we can test the model against a new data for detection of Parkinson disease.","","979-8-3503-3583-5","10.1109/ICISCoIS56541.2023.10100446","","https://ieeexplore.ieee.org/stamp/stamp.jsp?arnumber=10100446","CNN;Fully Connected Neural Network;Voice and Image Dataset","Support vector machines;Parkinson's disease;Predictive models;Prediction algorithms;Data models;Hybrid power systems;Convolutional neural networks","","2","","15","IEEE","19 Apr 2023","","","IEEE","IEEE Conferences"
"Parkinson's Disease Classification with Self-supervised Learning and Attention Mechanism","Y. Zhang; H. Lei; Z. Huang; Z. Li; C. -M. Liu; B. Lei","Menglu Zhao College of Computer Science and Software Engineering, Shenzhen University, Shenzhen, China; Menglu Zhao College of Computer Science and Software Engineering, Shenzhen University, Shenzhen, China; Menglu Zhao College of Computer Science and Software Engineering, Shenzhen University, Shenzhen, China; College of Computer Science and Technology, Nanjing University of Aeronautics and Astronautics, Nanjing, China; Computer Science and Information Engineering, National Taipei University of Technology, Taipei, Taiwan; School of Biomedical Engineering, Shenzhen University, Shenzhen, China",2022 26th International Conference on Pattern Recognition (ICPR),"29 Nov 2022","2022","","","4601","4607","Parkinson’s disease (PD) is a neurodegenerative geriatric disease commonly occurring in middle-aged and elderly adults. Since PD is irreversible and its treatment only slows down its rate of development, the early diagnosis by accurate prediction is of great significance to retard its deterioration. However, the existing computer-assisted diagnosis methods for PD have limitations in exploring the implicit and spatial information in the brain. In view of this limitation, a 3D network based on self-supervised learning strategy and attention mechanism is proposed for PD classification in this paper. The proposed method put the input of successive frames from the preprocessed magnetic resonance imaging (MRI) data into 3D ResNet18 with the classifier module for PD classification. Specifically, the attention mechanism is used to explore the discriminative features. Meanwhile, a self-supervised learning pretext task and a regression task are designed to assist in training and improve the robustness of the proposed model. We use a 5-fold cross-validation strategy to corroborate our method’s effectiveness on the Parkinson's Progression Markers Initiative (PPMI) dataset. The experimental results indicate that our proposed method has achieved an accuracy of 87.50% for PD classification, which outperforms the most state-of-the-art deep learning methods.","2831-7475","978-1-6654-9062-7","10.1109/ICPR56361.2022.9956213","","https://ieeexplore.ieee.org/stamp/stamp.jsp?arnumber=9956213","Parkinson's disease;self-supervised learning;attention mechanism;magnetic resonance imaging","Training;Solid modeling;Three-dimensional displays;Parkinson's disease;Magnetic resonance imaging;Self-supervised learning;Robustness","","7","","27","IEEE","29 Nov 2022","","","IEEE","IEEE Conferences"
"Robotics-Based Characterization of Sensorimotor Integration in Parkinson’s Disease and the Effect of Medication","Y. K. Tamilselvam; M. S. Jog; R. V. Patel","Department of Electrical and Computer Engineering, Canadian Surgical Technologies and Advanced Robotics (CSTAR), University of Western Ontario (UWO), London, Canada; Department of Clinical Neurological Sciences, and the Department of Electrical and Computer Engineering, London Movement Disorders Centre, UWO, London, Canada; Department of Electrical and Computer Engineering, the Department of Surgery, and the Department of Clinical Neurological Sciences, CSTAR, UWO, London, Canada",IEEE Transactions on Neural Systems and Rehabilitation Engineering,"9 Aug 2023","2023","31","","3201","3211","Integration of multi-modal sensory inputs and modulation of motor outputs based on perceptual estimates is called Sensorimotor Integration (SMI). Optimal functioning of SMI is essential for perceiving the environment, modulating the motor outputs, and learning or modifying motor skills to suit the demands of the environment. Growing evidence suggests that patients diagnosed with Parkinson’s Disease (PD) may suffer from an impairment in SMI that contributes to perceptual deficits, leading to motor abnormalities. However, the exact nature of the SMI impairment is still unclear. This study uses a robot-assisted assessment tool to quantitatively characterize SMI impairments in PD patients and how they affect voluntary movements. A set of assessment tasks was developed using a robotic manipulandum equipped with a virtual-reality system. The sensory conditions of the virtual environment were varied to facilitate the assessment of SMI. A hundred PD patients (before and after medication) and forty-three control subjects completed the tasks under varying sensory conditions. The kinematic measures obtained from the robotic device were used to evaluate SMI. The findings reveal that across all sensory conditions, PD patients had 36% higher endpoint error, 38% higher direction error in reaching tasks, and 43% higher number of violations in tracing tasks than control subjects due to impairment in integrating sensory inputs. However, they still retained motor learning ability and the ability to modulate motor outputs. The medication worsened the SMI deficits as PD patients, after medication, performed worse than before medication when encountering dynamic sensory environments and exhibited impaired motor learning ability.","1558-0210","","10.1109/TNSRE.2023.3299884","Mitacs Accelerate Program(grant numbers:R2881A07); Natural Sciences and Engineering Research Council (NSERC) of Canada(grant numbers:RGPIN-1345); Tier-1 Canada Research Chairs Program; ","https://ieeexplore.ieee.org/stamp/stamp.jsp?arnumber=10196468","Sensorimotor integration;Parkinson’s disease;KINARM endpoint robot","Robot sensing systems;Task analysis;Medical diagnostic imaging;Feature extraction;Visualization;Parkinson's disease;Testing","Parkinson Disease;Humans;Male;Female;Middle Aged;Robotics;Machine Learning;Task Performance and Analysis","5","","36","CCBY","28 Jul 2023","","","IEEE","IEEE Journals"
"Striatal Subdivisions Estimated via Deep Embedded Clustering With Application to Parkinson's Disease","Y. Li; A. Liu; T. Mi; R. Yang; P. Chan; M. J. McKeown; X. Chen; F. Wu","Department of Electronic Science and Technology, University of Science and Technology of China, Hefei, China; Department of Electronic Science and Technology, University of Science and Technology of China, Hefei, China; Department of Neurology, Neurobiology and Geriatrics, Xuanwu Hospital of Capital Medical University, Beijing Institute of Brain Disorders, Beijing, China; Department of Electronic Engineering and Information Science, University of Science and Technology of China, Hefei, China; Department of Neurology, Neurobiology and Geriatrics, Xuanwu Hospital of Capital Medical University, Beijing Institute of Brain Disorders, Beijing, China; Pacific Parkinson's Research Centre, Vancouver, BC, Canada; Department of Electronic Engineering and Information Science, University of Science and Technology of China, Hefei, China; Department of Electronic Engineering and Information Science, University of Science and Technology of China, Hefei, China",IEEE Journal of Biomedical and Health Informatics,"3 Sep 2021","2021","25","9","3564","3575","Recent fMRI connectivity-based parcellation (CBP) methods have been developed to obtain homogeneous and functionally coherent brain parcels. However, most of these studies utilize traditional clustering methods that neglect hidden nonlinear features. To enhance parcellation performance, here we propose a deep embedded connectivity-based parcellation (DECBP) framework and apply it to determine functional subdivisions of the striatum in public resting state fMRI data sets. This framework integrates fMRI connectivity features into deep embedded clustering (DEC), a deep neural network based on a stacked autoencoder. Compared to three prevalent clustering methods and their combinations with principal component analysis (PCA), the DECBP exhibited a significantly higher similarity between scans, individuals, and groups, indicating enhanced reproducibility. The generated reliable parcellations were also largely consistent with other public atlases. We further explored the functional subunits in the striatum in a data set from 23 Parkinson's disease (PD) subjects and 27 age-matched healthy controls (HC). All putaminal subregions of PD demonstrated lower interhemispheric connectivity than those of HC, which might reflect imbalance in the pathological progression of PD. Such hypo-connectivity was also observed between putaminal subregions and other brain regions, reflecting neuroimaging manifestations of the altered cortico-striato-thalamo-cortical circuit. These observed weaker couplings were associated with PD severity and duration. Our results support the utilization of the DECBP framework and suggest that abnormal connectivity in putaminal subregions may be a potential indicator of PD.","2168-2208","","10.1109/JBHI.2021.3083879","National Natural Science Foundation of China(grant numbers:61922075); National Key R&D Program of China(grant numbers:2018YFC1312001,2017YFC0840105); USTC Research Funds of the Double First-Class Initiative(grant numbers:YD2100002004); Synergy Innovation Program of Anhui Province(grant numbers:GXXT-2019-025); John Nichol Chair in Parkinson's Research (MJM); ","https://ieeexplore.ieee.org/stamp/stamp.jsp?arnumber=9442339","Resting-state fMRI;deep neural network;deep embedded connectivity-based parcellation;parkinson's disease","Functional magnetic resonance imaging;Diseases;Head;Correlation;Clustering methods;Bioinformatics;Reliability","Brain Mapping;Cluster Analysis;Humans;Magnetic Resonance Imaging;Neural Pathways;Parkinson Disease;Reproducibility of Results","10","","54","IEEE","26 May 2021","","","IEEE","IEEE Journals"
"Benchmarking Skeleton-based Motion Encoder Models for Clinical Applications: Estimating Parkinson's Disease Severity in Walking Sequences","V. Adeli; S. Mehraban; I. Ballester; Y. Zarghami; A. Sabo; A. Iaboni; B. Taati","University of Toronto, CA; University of Toronto, CA; Vienna University of Technology, AUST; University of Toronto, CA; KITE - Toronto Rehabilitation Institute - University Health Network, CA; University of Toronto, CA; University of Toronto, CA",2024 IEEE 18th International Conference on Automatic Face and Gesture Recognition (FG),"11 Jul 2024","2024","","","1","10","Parkinson's Disease is a degenerative disorder for which precise motor assessment is critical. This study investigates the application of general human motion encoders trained on large-scale human motion datasets for analyzing gait patterns in PD patients. Although these models have learned a wealth of human biomechanical knowledge, their effectiveness in analyzing pathological movements, such as parkinsonian gait, has yet to be fully validated. We propose a comparative framework and evaluate six pre-trained state-of-the-art human motion encoder models on their ability to predict the Movement Disorder Society - Unified Parkinson's Disease Rating Scale (MDS-UPDRS-III) gait scores from motion capture data. We compare these against a traditional gait feature-based predictive model in a recently released large public PD dataset, including PD patients on and off medication. The feature-based model currently shows higher weighted average accuracy, precision, recall, and F1-score. Motion encoder models with closely comparable results demonstrate promise for scalability and efficiency in clinical settings. This potential is underscored by the enhanced performance of the encoder model upon fine-tuning on PD training set. Four of the six human motion models examined provided prediction scores that were significantly different between on- and off-medication states. This finding reveals the sensitivity of motion encoder models to nuanced clinical changes, emphasizing their potential utility in clinical settings. It also underscores the necessity for continued customization of these models to better capture disease-specific features, thereby reducing the reliance on labor-intensive feature engineering. Lastly, we establish a benchmark for the analysis of skeleton-based motion encoder models in clinical settings. To the best of our knowledge, this is the first study to provide a benchmark that enables state-of-the-art models to be tested and compete in a clinical context. Codes and benchmark leaderboard are available at code.","2770-8330","979-8-3503-9494-8","10.1109/FG59268.2024.10581933","","https://ieeexplore.ieee.org/stamp/stamp.jsp?arnumber=10581933","","Analytical models;Adaptation models;Codes;Parkinson's disease;Biological system modeling;Benchmark testing;Predictive models","","1","","52","IEEE","11 Jul 2024","","","IEEE","IEEE Conferences"
"A reliable subtyping of de novo Parkinson disease: biomarkers, medication effects and longitudinal progression","C. Sun; H. Xu; Y. Zhang; Y. Zhang","Research Center for Augmented Intelligence, Research Institute of Artificial Intelligence, Zhejiang Lab, Hangzhou, China; Zhejiang University, Hangzhou, China; School of Life Science and Technology, University of Electronic Science and Technology of China, Chengdu, China; Research Center for Augmented Intelligence, Research Institute of Artificial Intelligence, Zhejiang Lab, Hangzhou, China",2023 45th Annual International Conference of the IEEE Engineering in Medicine & Biology Society (EMBC),"11 Dec 2023","2023","","","1","4","Divergent clinical symptoms and pathological progression suggest multiple subtypes of Parkinson disease (PD). Here, we proposed a reliable PD subtyping approach that quantifies the disturbance of an individual patient to the reference structural covariance networks derived from healthy controls. We revealed two subtypes of de novo PD patients by using longitudinal data from the PPMI dataset. Compared to the conventional clinical TD/PIGD phenotypes, our subtyping was highly stable in 5 years’ visits. The two subtypes of PD showed significant differences in motor symptoms, medication effects, CSF biomarkers, and longitudinal progression. Moreover, patients of subtype 2 showed widespread lower cortical-to-dorsal raphe nucleus (DRN) connections and higher medication effects on motor symptoms which was regulated by 5-HT neurons in DRN. Our results suggest distinct neuropathological pathways underlying the two subtypes, such that, in contrast to the typical PD subtype, patients of subtype 2 may be affected by serotonergic modulation on dopaminergic neurons in striatum. Our study opens new avenue to precision medicine and personalized treatments in PD and may be applicable to other neurodegenerative diseases.","2694-0604","979-8-3503-2447-1","10.1109/EMBC40787.2023.10340372","National Natural Science Foundation of China; ","https://ieeexplore.ieee.org/stamp/stamp.jsp?arnumber=10340372","","Pathology;Precision medicine;Neurons;Modulation;Biomarkers;Biology;Reliability","Humans;Parkinson Disease;Gait Disorders, Neurologic;Biomarkers;Phenotype;Dopaminergic Neurons","","","14","IEEE","11 Dec 2023","","","IEEE","IEEE Conferences"
"Exploring Computational Models for Parkinson’s Disease Diagnosis: Unveiling Insights with LIME and SHAP Explainability Techniques","P. A. C. D; A. M. P; A. Kodipalli; T. Rao","Dept. of Artificial Intelligence & Data Science, Global Academy of Technology, Bangalore, Karnataka, India; Dept. of Artificial Intelligence & Data Science, Global Academy of Technology, Bangalore, Karnataka, India; Dept. of Artificial Intelligence & Data Science, Global Academy of Technology, Bangalore, Karnataka, India; Dept. of Artificial Intelligence & Data Science, Global Academy of Technology, Bangalore, Karnataka, India",2024 International Conference on Knowledge Engineering and Communication Systems (ICKECS),"7 Aug 2024","2024","1","","1","6","Parkinson’s disease (PD) is a degenerative neurological disorder affecting a large portion of the world’s population, mostly the elderly. A patient has to be diagnosed with Parkinson’s disease (PD) as soon as feasible to receive appropriate management and intervention. This is because early diagnosis opens up treatment choices that can significantly improve patient’s quality of life. To develop advanced diagnostic models for Parkinson’s disease, there has been a notable rise in research at the intersection of computer science and medicine. Preprocessing data, choosing pertinent features, and training models-such as Decision Trees, SVM, K-Nearest Neighbors, Logistic Regression, and other boosting algorithms-are all part of the research. To diagnose Parkinson’s disease, the comparison analysis evaluates model performance indicators and emphasizes interpretability using LIME and SHAP approaches. The usefulness, benefits, and drawbacks of the many computer models utilized in Parkinson’s disease diagnosis are thoroughly examined in this article.","","979-8-3503-5968-8","10.1109/ICKECS61492.2024.10616831","","https://ieeexplore.ieee.org/stamp/stamp.jsp?arnumber=10616831","Parkinson’s disease (PD) diagnosis;Support Vector Machine (SVM);LIME (Local Interpretable Modelagnostic Explanations);SHAP (SHapley Additive exPlanations)","Training;Support vector machines;Analytical models;Accuracy;Computational modeling;Nearest neighbor methods;Data models","","3","","14","IEEE","7 Aug 2024","","","IEEE","IEEE Conferences"
"Characterization of gait dynamics using fractal analysis for normal and Parkinson disease patients","M. Chakraborty; T. Das; D. Ghosh","School of Bio-Science & Engineering, Jadavpur University, Kolkata, India; Department of Physics, Jadavpur University, Kolkata, India; Sir C. V. Raman Centre for Physics and Music, Jadavpur University, Kolkata, India","2015 IEEE Power, Communication and Information Technology Conference (PCITC)","24 Mar 2016","2015","","","367","372","Gait dynamics of human appears to have a self-similar pattern and this self-similarity is studied using various non-linear methods. In this paper we employ three non-linear methods namely Hurst's rescaled range analysis method, Higuchi's fractal dimension method, Approximate entropy method to quantize the gait dynamics of people suffering from Parkinson diseases (PD). Also they are asked to perform `Dual task' while walking, to have a better understanding of the connection between central nervous system and the limb movement. Gait dynamics of normal healthy people are also included in this study as control group. They are also put under study to perform dual task. This data set has been acquired from MIT-BIH data base. All these methods are capable to detect the difference between `Normal walking' and `Dual tasking' for both the groups. The fractal exponents for `Dual task' however produce interesting findings for PD subjects, suggesting that this type of walk is more chaotic and is more disordered than control group with the same task. Amongst the three methods utilized in this work approximate entropy method appears to be more sensitive, for both the groups.","","978-1-4799-7455-9","10.1109/PCITC.2015.7438193","","https://ieeexplore.ieee.org/stamp/stamp.jsp?arnumber=7438193","Approximate Entropy;Fractal dimension;Gait dynamics;Higuchi's fractal dimension;Parkinson disease;Rescaled range analysis","Fractals;Time series analysis;Legged locomotion;Entropy;Diseases;Correlation;Information and communication technology","","5","","18","IEEE","24 Mar 2016","","","IEEE","IEEE Conferences"
