"Enhancing Parkinson’s Disease Detection and Diagnosis: A Survey of Integrative Approaches Across Diverse Modalities","C. R. Dhivyaa; K. Nithya; S. Anbukkarasi","School of Computer Science and Engineering, Vellore Institute of Technology, Vellore, Tamil Nadu, India; Department of Computer Science and Engineering, SRM Institute of Science and Technology, Tiruchirappalli, Tamil Nadu, India; Department of Computer Science and Engineering, SRM Institute of Science and Technology, Tiruchirappalli, Tamil Nadu, India",IEEE Access,"5 Nov 2024","2024","12","","158999","159024","Parkinson’s disease (PD) is a chronic neurodegenerative illness that affects the brain and central nervous system, leading to issues with pain, mobility, mood, and sleep. Early and precise diagnosis is vital for effective medical intervention and enhancing the quality level of life for patients. This review provides an extensive overview of current PD detection methods, emphasizing the integration of neuroimaging techniques, clinical data, and advanced computational algorithms. A wide range of neuroimaging modalities are examined by highlighting their roles in identifying structural and functional brain changes linked to PD. The review also explores the potential of datasets such as handwritten samples, Electroencephalography (EEG), Electrocardiography (ECG), voice recordings, gait analysis, and sensor data for PD detection. The review discusses various stages of data processing, including preprocessing, segmentation, and feature extraction, essential for improving the accuracy and efficiency of diagnostic models. The application of machine learning, deep learning, and transfer learning models for PD classification and prediction is reviewed, focusing on feature selection, model optimization, and the utilization of large, diverse datasets. AI systems can provide reliable and accurate Parkinson’s disease (PD) identification, enabling more efficient and prompt therapeutic treatments, by utilizing these sophisticated algorithms and a variety of datasets.","2169-3536","","10.1109/ACCESS.2024.3487001","Vellore Institute of Technology, Vellore, India; ","https://ieeexplore.ieee.org/stamp/stamp.jsp?arnumber=10736615","Parkinson’s disease;dataset;machine learning;transfer learning;segmentation","Parkinson's disease;Magnetic resonance imaging;Electroencephalography;Diseases;Motors;Neuroimaging;Feature extraction;Training;Surveys;Accuracy","","5","","141","CCBYNCND","28 Oct 2024","","","IEEE","IEEE Journals"
"Serious games as a means for holistically supporting Parkinson's Disease patients: The i-PROGNOSIS personalized game suite framework","S. B. Dias; E. Konstantinidis; J. A. Diniz; P. Bamidis; V. Charisis; S. Hadjidimitriou; M. Stadtschnitzer; P. Fagerberg; I. Ioakeimidis; K. Dimitropoulos; N. Grammalidis; L. J. Hadjileontiadis","Faculdade de Motricidade Humana, Universidade de Lisboa, Portugal; Aristotle University of Thessaloniki, Thessaloniki, Greece; Faculdade de Motricidade Humana, Universidade de Lisboa, Portugal; Aristotle University of Thessaloniki, Thessaloniki, Greece; Aristotle University of Thessaloniki, Thessaloniki, Greece; Aristotle University of Thessaloniki, Thessaloniki, Greece; Fraunhofer Institute IAIS, Sankt Augustin, Germany; Karolinska Institutet, Stockholm, Sweden; Karolinska Institutet, Stockholm, Sweden; Centre for Research & Technology, Thessaloniki, Greece; Centre for Research & Technology, Thessaloniki, Greece; Khalifa University of Science and Technology, Abu Dhabi, UAE",2017 9th International Conference on Virtual Worlds and Games for Serious Applications (VS-Games),"5 Oct 2017","2017","","","237","244","Parkinson's Disease (PD) is a well-known progressive and neurodegenerative disorder, resulting in motor and non-motor symptoms that significantly reduce the quality of life. Motivated by the increased adoption of serious games in health care interventions sector in the last years, an unobtrusive approach is explored here, realised via the i-PROGNOSIS interventions platform (www.i-prognosis.eu), consisting of a game-based suite. In this way, targeting intelligent early detection and intervention in PD area, the Personalised Game Suite (PGS) design approach is presented, integrating different serious games in a unified platform. Overall, this comprehensive review gives an overview of studies examining motor and non-motor symptoms for PD along with the PGS design approach, in order to inform researchers and game designers for its consideration in the self-management of PD.","2474-0489","978-1-5090-5812-9","10.1109/VS-GAMES.2017.8056607","","https://ieeexplore.ieee.org/stamp/stamp.jsp?arnumber=8056607","Parkinson's Disease;i-PROGNOSIS;Personalized Game Suite;Serious Games","Games;Diseases;Psychology","","14","","79","IEEE","5 Oct 2017","","","IEEE","IEEE Conferences"
"Analysis on Parkinson’s disease through Faradaic Detection","H. Adam; S. C. B. Gopinath; M. K. M. Arshad; M. A. Fakhri; E. T. Salim; V. Perumal; A. A. N. Gunny; T. Adam","Institute of Nano Electronic Engineering, Universiti Malaysia Perlis (UniMAP), Kangar, Malaysia; Faculty of Chemical Engineering & Technology, Universiti Malaysia Perlis (UniMAP), Arau, Malaysia; Faculty of Electronic Engineering & Technology, Universiti Malaysia Perlis (UniMAP), Arau, Malaysia; Applied Science Department, University of Technology-Iraq, Baghdad, Iraq; Laser and Optoelectronics Eng. Department, University of Technology-Iraq, Baghdad, Iraq; Department of Mechanical Engineering, Universiti Teknologi PETRONAS, Perak, Malaysia; Faculty of Chemical Engineering & Technology, Universiti Malaysia Perlis (UniMAP), Arau, Malaysia; Faculty of Electronic Engineering & Technology, Universiti Malaysia Perlis (UniMAP), Arau, Malaysia",2023 IEEE International Conference on Sensors and Nanotechnology (SENNANO),"19 Dec 2023","2023","","","212","215","Parkinson's disease is a neurological condition affecting the motor system, causing dopaminergic neuron death in the substantia nigra, leading to reduced dopamine levels and motor function deficits. Given the complex nature of Parkinson's disease, relying solely on motor symptoms for diagnosis may not be sufficient. To address this limitation, researchers have turned their attention to the identification and quantification of biomarkers that can serve as indicators of Parkinson's disease. Faradaic detection is a promising method for Parkinson's disease research, using electrochemical processes to detect and quantify biomarker like alpha synuclein. This approach helps monitor surface resistance, binding processes, and electrolyte resistance in the system. Quantification of biomarkers plays a crucial role in detecting early stages of the disease and tracking its progression. Through Faradaic detection methods, this study was able to measure the levels of specific biomarkers that are associated with Parkinson's disease. This approach allows for a more sensitive and accurate detection of Parkinson's disease, even in its early stages, which can improve the chances of early intervention and effective treatment.","","979-8-3503-3331-2","10.1109/SENNANO57767.2023.10352562","","https://ieeexplore.ieee.org/stamp/stamp.jsp?arnumber=10352562","Parkinson’s disease;alpha synuclein;redox reagent;faradaic electrochemical impedance spectroscopy;biosensor","Surface impedance;Parkinson's disease;Current measurement;Surface resistance;Biomarkers;Real-time systems;Sensors","","1","","5","IEEE","19 Dec 2023","","","IEEE","IEEE Conferences"
"Parkinson's Disease Detection and Analysis Using Machine Learning","A. Prabhu B P; C. Bhatt; N. Mohd; T. Sharma; M. Singh","Department of Computer Science and Engineering, Alliance University, Bangalore, India; Department of Computer Science and Engineering, Alliance University, Bangalore, India; Department of Computer Science and Engineering, Graphic Era (Deemed to be) University, Dehradun, India; Department of Computer Science and Engineering, Graphic Era (Deemed to be) University, Dehradun, India; Department of Computer Science and Engineering, Alliance University, Bangalore, India",2024 Second International Conference on Advances in Information Technology (ICAIT),"4 Oct 2024","2024","1","","1","6","Neurodegenerative disease Parkinson's, which have both motor and non-motor type of symptoms, is one of the biggest problems, which gets consideration in the public health department. To assurance of patients and beneficial therapeutics process diagnosis should occur in the critical stages and should also be precise. The aim of this study is developing of the machine learning methods for the diagnosis and appraisal of Parkinson's disease. Dataset which contains patient data is used where each record has important attributes such as age, height, weight, gender, and so forth is obtained from the University of California Irvine (UCI) Machine Learning Repository. The research process commences with a detailed data-gathering procedure which is followed by an investigative exploratory data analysis to discover an inherent pattern shared by all Parkinsonian traits. The data visualization tools can help us more deep information about Parkinson's disease symptoms. The task of making sure that the Minority Random Oversampling method is properly implemented in data preparation is quite significant for us as we work on the project because it is one of the important aspects. On the other hand, the flare Light Gradient Boosted Machine (LightGBM) model is the one we use for this particular purpose. When run on the test dataset, this state of the art algorithm hits the almost perfect result of 99.24% accuracy. As well as adding up new facts to the science of the Parkinson's disease research, this work shows how powerful computer algorithms and perfect datasets are in the spreading accurate diagnoses of Parkinson's disease.","","979-8-3503-8386-7","10.1109/ICAIT61638.2024.10690837","","https://ieeexplore.ieee.org/stamp/stamp.jsp?arnumber=10690837","parkinson;neurology;EEG;LightGBM;Health;Data Analysis","Analytical models;Accuracy;Machine learning algorithms;Data analysis;Parkinson's disease;Computational modeling;Data visualization;Machine learning;Brain modeling;Recording","","1","","22","IEEE","4 Oct 2024","","","IEEE","IEEE Conferences"
"Using gait parameters to recognize various stages of Parkinson's disease","E. Rastegari; V. Marmelat; L. Najjar; D. Bastola; H. H. Ali","College of Information Science and Technology, University of Nebraska at Omaha, Omaha, NE, USA; University of Nebraska at Omaha, Omaha, NE, US; College of Information Science and Technology, University of Nebraska at Omaha, Omaha, NE, USA; College of Information Science and Technology, University of Nebraska at Omaha, Omaha, NE, USA; College of Information Science and Technology, University of Nebraska at Omaha, Omaha, NE, USA",2017 IEEE International Conference on Bioinformatics and Biomedicine (BIBM),"18 Dec 2017","2017","","","1647","1651","Monitoring gait patterns seamlessly and continuously over time provides valuable information that could help physicians diagnose diseases in the early stages. Currently, traditional gait measurement approaches do not support continuous monitoring of gait and focus on collecting limited data points in controlled lab environments. However, with advancements in wireless technology, movement patterns can be recorded using small portable wearable devices. Parkinson's disease (PD) is a progressively disabling neurodegenerative disorder that is affecting gait and posture and consequently leads to higher risk of falling. Several research studies have looked into changes in the gait parameters of PD patients compared to healthy adults. However, there are only few studies with the focus on gait assessment of PD patients in the early stages as compared to patterns associated with patients at advanced stages. In addition, the number of gait-related studies in this domain using accelerometers on ankle is very limited. Knowing which body location could serve as a target place for accelerometers to provide accurate information is a necessary step toward the health assessment of PD patients. The purpose of this study was to evaluate the gait parameters of patients with mild or moderate PD using accelerometers on ankles. A number of gait parameters, including average stride time, stride time variability, stride time symmetry, and oscillation of acceleration in the mediolateral (ML) direction were calculated and compared between PD patients and healthy elderlies. Preliminary results indicate that features extracted from accelerometers on ankles can be effective in differentiating between healthy elderlies and PD patients at mid-stages of disease but less so at earlier stages of disease.","","978-1-5090-3050-7","10.1109/BIBM.2017.8217906","","https://ieeexplore.ieee.org/stamp/stamp.jsp?arnumber=8217906","Gait patterns;Parkinson's Disease;early diagnosis;preventive healthcare;wearble devices;data analystics","Accelerometers;Protocols;Diseases;Senior citizens;Acceleration;Monitoring;Legged locomotion","","6","","30","IEEE","18 Dec 2017","","","IEEE","IEEE Conferences"
"Parkinson's Disease and Its's Stage Classification using Artificial Intelligence","U. R. M; R. R. P; S. V; T. S; R. S","Department of CSE, KPR Institute of Engineering And Technology, Coimbatore, India; Department of CSE, KPR Institute of Engineering And Technology, Coimbatore, India; Department of CSE, KPR Institute of Engineering And Technology, Coimbatore, India; Department of CSE, KPR Institute of Engineering And Technology, Coimbatore, India; Department of CSE, KPR Institute of Engineering And Technology, Coimbatore, India","2022 Second International Conference on Advanced Technologies in Intelligent Control, Environment, Computing & Communication Engineering (ICATIECE)","24 Feb 2023","2022","","","1","5","The disease Parkinson's Illness (PI) is a serious form of neurodegeneration. About in 90% of people suffering from PI have speech challenges in the initial phases. Speech as a result is in this study, traits were employed to categorize this condition. The most well-known speech characteristics used in PI research are vibration, sparkle, modulation index parameters, harmonicity variables, recurrence period density emission (RPDE), normalised variation interpretation (DFA), and pitch period entropy. These factors served as the baseline variables for the inquiry. This research studied PI using the Gradient boosted technique. The XGBoost technique initially gave a forecast recognition rate of 84.80% using all of the baseline data. Features from locShimmer (Fscore = 3) were discarded while selecting features for the model's improvement by plotting feature significance. The accuracy rating of the model has grown to 85.60% after feature selection was completed. We tried to improve the model we were using for the second features selection by deleting features with F-score values below 20. But after selecting these features, the model's accuracy fell to 84.40%. The model with an accuracy of 85.60% is hence the one that is selected.","","978-1-6654-9396-3","10.1109/ICATIECE56365.2022.10046891","","https://ieeexplore.ieee.org/stamp/stamp.jsp?arnumber=10046891","Parkinson;XGBoost;feature;dataset;Accuracy","Vibrations;Training;Parkinson's disease;Modulation;Feature extraction;Entropy;Power capacitors","","1","","18","IEEE","24 Feb 2023","","","IEEE","IEEE Conferences"
"Multivariate Analysis of Joint Motion Data by Kinect: Application to Parkinson’s Disease","P. Ren; J. F. Bosch Bayard; L. Dong; J. Chen; L. Mao; D. Ma; M. A. Sanchez; D. M. Morejon; M. L. Bringas; D. Yao; M. Jahanshahi; P. A. Valdes-Sosa","MOE Key Laboratory for Neuroinformation, Clinical Hospital of Chengdu Brain Science Institute, University of Electronic Science and Technology of China, Chengdu, China; McGill Centre for Integrative Neuroscience (MCIN), Ludmer Centre for Neuroinformatics andMental Health, Montreal Neurological Institute (MNI), McGill University, Montreal, Canada; MOE Key Laboratory for Neuroinformation, Clinical Hospital of Chengdu Brain Science Institute, University of Electronic Science and Technology of China, Chengdu, China; MOE Key Laboratory for Neuroinformation, Clinical Hospital of Chengdu Brain Science Institute, University of Electronic Science and Technology of China, Chengdu, China; MOE Key Laboratory for Neuroinformation, Clinical Hospital of Chengdu Brain Science Institute, University of Electronic Science and Technology of China, Chengdu, China; Department of Rehabilitation Medicine, Key Laboratory of Birth Defects and Related Diseases of Women and Children, West China Second University Hospital of Sichuan University (WCSUH-SCU), Ministry of Education, Chengdu, China; Dr. Georges-L.-Dumont University Hospital Centre, Moncton, Canada; Cuban Neuroscience Center, Playa, Cuba; MOE Key Laboratory for Neuroinformation, Clinical Hospital of Chengdu Brain Science Institute, University of Electronic Science and Technology of China, Chengdu, China; MOE Key Laboratory for Neuroinformation, Clinical Hospital of Chengdu Brain Science Institute, University of Electronic Science and Technology of China, Chengdu, China; MOE Key Laboratory for Neuroinformation, Clinical Hospital of Chengdu Brain Science Institute, University of Electronic Science and Technology of China, Chengdu, China; MOE Key Laboratory for Neuroinformation, Clinical Hospital of Chengdu Brain Science Institute, University of Electronic Science and Technology of China, Chengdu, China",IEEE Transactions on Neural Systems and Rehabilitation Engineering,"8 Jan 2020","2020","28","1","181","190","Analysis of joint motion data (AJMD) by Kinect, such as velocity, has been widely used in many research fields, many of which focused on how one joint moves with another, namely bivariate AJMD. However, these studies might not accurately reflect the motor symptoms in patients. The human body can be divided into six widely accepted parts (head, trunk and four limbs), which are interrelated and interact with each other. Therefore, in this study we attempted to investigate how the major joints of one body part move with the ones in another body part, namely multivariate AJMD. For method illustration, the motion data of sit-to-stand-to-sit for healthy participants and people with Parkinson disease (PD) were employed. Four types of multivariate AJMD were investigated by eigenspace-maximal-information-canonical-correlation-analysis, which obtained maximal- information-eigen-coefficients (MIECes), the parameters for quantifying the correlation between two sets of joints located in two different body parts. The results show that healthy participants have significantly higher MIECes than the PD patients (p-value <; 0.0001). Furthermore, the area under the receiver operating characteristic curve value for the classification between healthy participants and PD patients reaches up to 1.00. In conclusion, we demonstrated the possibility of using multivariate AJMD for motion feature extraction, which may be helpful for medical research and engineering.","1558-0210","","10.1109/TNSRE.2019.2953707","National Natural Science Foundation of China(grant numbers:81601585,81871446); University of Electronic Science and Technology of China; ","https://ieeexplore.ieee.org/stamp/stamp.jsp?arnumber=8902003","Bivariate analysis;human motion analysis;joint motion data;kinect;motion feature extraction;multivariate analysis;Parkinson’s disease (PD);sit-to-stand-to-sit;velocity","Feature extraction;Tracking;Image color analysis;Parkinson's disease;Hospitals;Legged locomotion","Adult;Aged;Algorithms;Biomechanical Phenomena;Female;Healthy Volunteers;Humans;Joints;Male;Middle Aged;Motion;Multivariate Analysis;Parkinson Disease;ROC Curve;Sitting Position;Standing Position","13","","74","IEEE","15 Nov 2019","","","IEEE","IEEE Journals"
"Parkinson's Disease Severity Assessment: A Comparative Study & Interpretability Analysis","U. Tiwari; P. R. Jahanve; S. Karna; A. M; P. B. Pati; B. P. KN","Department of Computer Science and Engineering, Amrita School of Computing Bengaluru, Amrita Vishwa Vidyapeetham, India; Department of Computer Science and Engineering, Amrita School of Computing Bengaluru, Amrita Vishwa Vidyapeetham, India; Department of Computer Science and Engineering, Amrita School of Computing Bengaluru, Amrita Vishwa Vidyapeetham, India; Department of Computer Science and Engineering, Amrita School of Computing Bengaluru, Amrita Vishwa Vidyapeetham, India; Department of Computer Science and Engineering, Amrita School of Computing Bengaluru, Amrita Vishwa Vidyapeetham, India; Bioinformatics Institute, A*STAR, Singapore",2024 5th International Conference for Emerging Technology (INCET),"26 Jul 2024","2024","","","1","5","Parkinson's disease (PD) is a progressive neurological disorder that mainly affects people over the age of sixty. Currently, there is no such cure for PD. However, Treatments are available to help relieve the symptoms related to PD. A rating tool called MDS-UPDRS III is used to gauge the severity and progression and stages of disease severity are measured by the Hoehn and Yahr (NHY) staging system. This study performs a comparative analysis of the effectiveness of various machine learning models such as AdaBoost, XGBoost, Gradient Boosting Classifier (GBC), Decision Trees (DT), K-Nearest Neighbor (KNN), Logistic regression (LR), and Gaussian Naïve Bayes (GNB) on a dataset containing a variety of PD-related features obtained from 2861 persons. Local Interpretable Model-agnostic Explanations (LIME) is employed to perform the analysis of the strength of each feature toward the outcome prediction for various classification tasks. It is observed that the AdaBoost classifier delivers superior performance of 93.2% accuracy and 84.2% F1-Score for the dataset.","","979-8-3503-6115-5","10.1109/INCET61516.2024.10593180","","https://ieeexplore.ieee.org/stamp/stamp.jsp?arnumber=10593180","Parkinson's Disease;Machine Learning;MDS-UPDRS III;LIME","Analytical models;Logistic regression;Accuracy;Parkinson's disease;Predictive models;Nearest neighbor methods;Speech enhancement","","2","","22","IEEE","26 Jul 2024","","","IEEE","IEEE Conferences"
"Enhancing Parkinson's Disease Diagnosis: A Stacking Ensemble Approach Leveraging Machine Learning Techniques","O. Asmae; S. Saleh; R. Abdelhadi; B. Bachir","EEIS Laboratory, ENSET of Mohammedia, Hassan II University of Casablanca, Morocco; EEIS Laboratory, ENSET of Mohammedia, Hassan II University of Casablanca, Morocco; EEIS Laboratory, ENSET of Mohammedia, Hassan II University of Casablanca, Morocco; Faculty of sciences Dhar El Mahraz, Sidi Mohammed Ben Abdellah University, Morocco","2024 4th International Conference on Innovative Research in Applied Science, Engineering and Technology (IRASET)","13 Jun 2024","2024","","","1","7","Accurate diagnosis of Parkinson's Disease (PD) is crucial for effective management and timely intervention. However, traditional diagnostic methods often struggle to differentiate among Parkinsonian variants, leading to diagnostic errors. To address this challenge, we propose an Enhanced Stacking Ensemble (ESE) model that leverages machine learning techniques to enhance PD diagnosis. The ESE model integrates multiple algorithms through a stacking ensemble approach, with five base learners (XGB, SGD, ET, GB, and KNN) optimized using Bayesian hyperparameters. By combining outputs from the base learners, the stacking ensemble model improves predictive accuracy. Simulation results demonstrate superior performance compared to traditional ensemble methodologies and single classifiers, highlighting the effectiveness of our approach in enhancing PD diagnosis. This advancement shows promise in enhancing the clinical reliability of PD diagnosis, ultimately leading to improved patient outcomes and more informed medical decision-making.","","979-8-3503-0950-8","10.1109/IRASET60544.2024.10549375","","https://ieeexplore.ieee.org/stamp/stamp.jsp?arnumber=10549375","Stacking Ensemble;Parkinson;Machine Learning;Feature selection","Sensitivity;Parkinson's disease;Soft sensors;Simulation;Stacking;Predictive models;Prediction algorithms","","2","","23","IEEE","13 Jun 2024","","","IEEE","IEEE Conferences"
