"Feature Selection and Classification Algorithm Approaches for Parkinson's Disease Detection","H. Marcos; B. Warsito; A. Wibowo","Department Informatics Universitas Amikom Purwokerto, Doctoral Program Information System, Diponegoro University, Purwokerto, Indonesia; Department of Statistics, Faculty of Science and Mathematics, Diponegoro University, Semarang, Indonesia; Department Informatics Universitas Amikom Purwokerto, Doctoral Program Information System, Diponegoro University, Purwokerto, Indonesia","2021 IEEE 5th International Conference on Information Technology, Information Systems and Electrical Engineering (ICITISEE)","30 Dec 2021","2021","","","95","99","Millions of people worldwide have developed Parkinson's disease (PD), which is more common by 50. Advances in information technology, especially in the field of machine learning, are being challenged for the development of early detection algorithms. This helps doctors to detect disease early and more accurately based on data. The available data has large dimensions and features so that the feature selection method can be used. This research paper aims to provide insight by comparing several algorithms for feature selection and PD classification. PD classification can help improve treatment efficiency and save time. The problem that arises is how the classification algorithm can show better and more efficient accuracy results. A large number of datasets is one of the challenges in the development of classification algorithms. The voice input dataset was obtained from the UCI machine learning repository. Bagging's algorithm out performed on average 100%, and MLP 96.58%, and RF 92.52%.","","978-1-6654-0196-8","10.1109/ICITISEE53823.2021.9655774","","https://ieeexplore.ieee.org/stamp/stamp.jsp?arnumber=9655774","accuracy;algorithm;classification;detection;feature selection;parkinson’s disease","Radio frequency;Parkinson's disease;Computational modeling;Machine learning;Feature extraction;Data models;Classification algorithms","","2","","28","IEEE","30 Dec 2021","","","IEEE","IEEE Conferences"
"Creating the Next Digital Telemedicine Tool for Parkinson's Disease Management with AI","R. D. Vieira; A. Arrais; D. Dias; C. Soares; J. Massano; J. P. S. Cunha","C-BER, INESC TEC, Porto, Portugal; C-BER, INESC TEC, Porto, Portugal; C-BER, INESC TEC, Porto, Portugal; Department of Neurology and Department of Clinical Neurosciences and Mental Health, CHUSJ, FMUP, Porto, Portugal; Department of Neurology and Department of Clinical Neurosciences and Mental Health, CHUSJ, FMUP, Porto, Portugal; INESC TEC, and Faculty of Engineering, University of Porto, Porto, Portugal",2024 IEEE EMBS International Conference on Biomedical and Health Informatics (BHI),"17 Mar 2025","2024","","","1","8","Parkinson's Disease (PD) is a neurological disease that progresses over time and causes severe motor symptoms. Therefore, treating PD requires constant patient monitoring, which may turn clinical practice overwhelming, preventing its practical implementation, and raising the need for patient monitoring outside the clinical setting. The iHandU system described in this paper fulfils this need by providing an objective way to quantify motor symptoms of PD in non-clinical settings. It integrates an innovative real-time assessment of the severity of motor symptoms based on signal processing and Machine Learning models that mimic the clinical severity classification scales used in practice and allows for a more continuous and personalized therapy planning and management by doctors, through the use of a web dashboard user-friendly interface. This system, recently tested at 5 patients' homes, has shown promising results as a PD patient management digital platform, reaching a usability score of 83.9% (A grade) based on the System Usability Scale (SUS). Such a level shows a strong alignment between user needs, expectations and functionalities. This study highlights the potential of the used system as a Patient Management Tool showing a case study from an ongoing clinical study. By giving additional information to the doctors with features beyond the semi-quantitative rating scales currently used, allowing a more optimized and continuous PD symptom management, it will be possible to advance PD management further.","2641-3604","979-8-3503-5155-2","10.1109/BHI62660.2024.10913661","","https://ieeexplore.ieee.org/stamp/stamp.jsp?arnumber=10913661","Parkinson's disease;Objective Assessment;mHealth;Clinical Study;Features Extraction;MDS-UPDRS Severity Classification;Machine Learning","Neurological diseases;Patient monitoring;Parkinson's disease;Telemedicine;Machine learning;Signal processing;Motors;Real-time systems;Planning;Usability","","","","32","IEEE","17 Mar 2025","","","IEEE","IEEE Conferences"
"Sensors for Parkinson's disease evaluation","R. Torres; M. Huerta; R. González; R. Clotet; J. Bermeo; G. Vayas","Universidad Simón Bolívar, Caracas, Venezuela; Universidad Politécnica Salesiana, Cuenca, Ecuador; Universidad Sergio Arboleda, Bogotá, Colombia; Universidad Simón Bolívar, Caracas, Venezuela; Universidad Politécnica Salesiana, Cuenca, Ecuador; Pontificia Universidad Católica del, Ambato, Ecuador","2017 International Caribbean Conference on Devices, Circuits and Systems (ICCDCS)","29 Jun 2017","2017","","","121","124","In the diagnosis and evaluation of Parkinson's disease (PD) the most frequent motor symptoms are: resting tremors, bradykinesia, gait disturbances, and freezing. In recent years, various types of sensors have been used to objectively quantify these symptoms in PD patients. This work presents a comparative analysis of the main characteristics of sensors developed for the data acquisition and measurement of different types of movement on an ongoing basis in the patients daily activities. This work also shows the application of sensors in an evaluation of postural tremor in hands on a group of young adults. The analysis developed indicates that the measurement of motor disorders, using some kind of body sensor and portable technologies, set the trend in monitoring of the symptoms PD.","2165-3550","978-1-5386-1962-9","10.1109/ICCDCS.2017.7959715","","https://ieeexplore.ieee.org/stamp/stamp.jsp?arnumber=7959715","Body Motion;Sensors and Parkinson's disease","Sensor phenomena and characterization;Pathology;Sensor systems;Monitoring;Batteries;Wrist","","3","","28","IEEE","29 Jun 2017","","","IEEE","IEEE Conferences"
"Prediction of Parkinson’s disease with various ML and DL techniques on speech data","T. Shankar; G. Sreelekha; C. S. Tejaswini; P. Sivasankar; N. Lavanya; J. Murali","School of Electronics Engineering, Vellore Institute of Technology, Vellore, India; School of Electronics Engineering, Vellore Institute of Technology, Vellore, India; School of Electronics Engineering, Vellore Institute of Technology, Vellore, India; Department of ECE, NITTTR, Chennai, India; School of Electronics Engineering, Vellore Institute of Technology, Vellore, India; School of Electronics Engineering, Vellore Institute of Technology, Vellore, India",2024 3rd International Conference on Artificial Intelligence For Internet of Things (AIIoT),"2 Jul 2024","2024","","","1","6","Parkinson’s disease(PD) is a degenerative peripheral nervous system syndrome that influences muscle movement. It is incurable. Parkinson’s disease impacts more than one million people in India each year. Because of the disease’s degenerative nature, symptoms usually appear gradually and are barely perceptible, ranging from ordinary trembling of the hand to apparent speech, and voice, as well as writing alterations to serious symptoms such as loss of automatic movements. This research aims to contribute to the improvement of medical technology by assisting in the advanced and premature identification of PD, permitting experimental therapy by the use of a voice dataset from UCI Machine Learning(ML) database. We reviewed the current state of PD discernment in this study and discussed the prototype for quick identification of PD using several classifier propositions of ML and Deep Learning(DL). The best accuracy of about 94.8% was achieved by the usage of the CNN model with optimizer. We have also further built a web-based GUI for the web-based prediction of PD using model build.","","979-8-3503-7212-0","10.1109/AIIoT58432.2024.10574537","","https://ieeexplore.ieee.org/stamp/stamp.jsp?arnumber=10574537","Parkinson’s disease;machine learning;deep learning;CNN;GUI","Deep learning;Machine learning algorithms;Accuracy;Prototypes;Predictive models;Writing;Prediction algorithms","","","","17","IEEE","2 Jul 2024","","","IEEE","IEEE Conferences"
"An Explainable Approach for Early Diagnosis of Parkinson's Disease Exploring Motor Symptoms","L. Aversano; A. Madau; D. Montano","Department of Agricultural, Food, Natural Resources and Engineering Sciences, University of Foggia, Foggia, Italy; Dept. of Engineering, University of Sannio, Benevento, Italy; CeRICT scrl, Regional Center Information Communication Technology, Benevento, Italy","2024 IEEE International Conference on Metrology for eXtended Reality, Artificial Intelligence and Neural Engineering (MetroXRAINE)","24 Dec 2024","2024","","","855","860","Parkinson's disease is a progressive neurodegen-erative disease that affects the nervous system causing severe cognitive, motor, and behavioral dysfunctions. It is mainly caused by a progressive loss of neurons in the substantia nigra in the basal ganglia and this leads to abnormalities in the control of movements. The symptoms progress slowly over the years and for this reason, the diagnosis of Parkinson's disease is very complex, so it is important to support medical personnel in identifying and predicting the disease with Artificial Intelligence tools and techniques. This study proposes a new approach to predict disease onset and monitor patient progress through Explainable Artificial Intelligence (XAI) that aims to provide clear and understandable explanations for decisions made by machine learning algorithms. Initially, different classification algorithms were evaluated and, by choosing the one with the best performance, the most significant features were identified through the use of SHAP. The model was subsequently re-evaluated with only the selected features, evaluating the use of the XAI for disease identification. The methodology was validated on the Parkinson's Progression Markers Initiative (PPMI), more specifically taking into consideration only the characteristics that concern the motor sphere.","","979-8-3503-7800-9","10.1109/MetroXRAINE62247.2024.10796585","","https://ieeexplore.ieee.org/stamp/stamp.jsp?arnumber=10796585","Explainability Artificial Intelligence;Parkinson's Disease;Feature Selection","Parkinson's disease;Explainable AI;Medical treatment;Motors;Feature extraction;Prediction algorithms;Classification algorithms;Personnel;Biomedical monitoring;Monitoring","","","","20","IEEE","24 Dec 2024","","","IEEE","IEEE Conferences"
"Connectivity-Based Brain Parcellation for Parkinson's Disease","Y. Li; A. Liu; L. Li; Y. Wu; M. J. McKeown; X. Chen; F. Wu","Department of Electronic Engineering and Information Science, University of Science and Technology of China, China; Department of Electronic Engineering and Information Science, University of Science and Technology of China, Hefei, China; First Affiliated Hospital of Anhui University of Chinese Medicine, China; First Affiliated Hospital of Anhui University of Chinese Medicine, China; Department of Medicine (Neurology) and Pacific Parkinson's Research Center, University of British Columbia, Canada; Department of Electronic Engineering and Information Science, University of Science and Technology of China, China; Department of Electronic Engineering and Information Science, University of Science and Technology of China, China",IEEE Transactions on Biomedical Engineering,"20 Apr 2023","2023","70","5","1539","1552","Connectivity-based parcellation (CBP) studies for exploring cerebral topographic organization have emerged rapidly, likely due to the joint developments of non-invasive imaging technologies and advances in computing science. CBP studies have extended our understanding of human brain development and many brain-related disorders such as Parkinson's Disease (PD), and have provided promising approaches to guide electrode placement during the planning of deep brain stimulation (DBS) surgery. This work reviews prevalent CBP methods, summarizing the methodological advantages and limitations of each. As PD is the second most common neurodegenerative disorder, we particularly focus on data-driven parcellation studies in this disease, providing researchers with a comprehensive overview of PD-specific atlases and their applications. We show that, while many advances have been achieved, heterogeneity in the PD population still provides an ongoing challenge to find a robust consensus on regional representation. Although some parcellation-driven studies exhibit encouraging achievements, these PD-specific parcellations are still limited and most approaches depend on a single modality. We discuss the future directions of parcellation-driven PD exploration and surgical planning, with the aim to inspire future investigation into connectivity-based parcellation for PD.","1558-2531","","10.1109/TBME.2022.3222072","National Natural Science Foundation of China(grant numbers:82272070,32271431,61922075); USTC Research Funds of the Double First-Class Initiative(grant numbers:KY2100000123,YD2100002004); University Synergy Innovation Program of Anhui Province(grant numbers:GXXT2019-025); John Nichol Chair in Parkinson's Research and Canadian Institutes of Health Research Project(grant numbers:PJT-175305); ","https://ieeexplore.ieee.org/stamp/stamp.jsp?arnumber=9953041","Connectivity-based parcellation;magnetic resonance imaging;Parkinson's disease;deep brain stimulation;pd-specific atlas","Satellite broadcasting;Diseases;Imaging;Functional magnetic resonance imaging;Electrodes;Sociology;White matter","Humans;Parkinson Disease;Brain;Deep Brain Stimulation","12","","143","IEEE","15 Nov 2022","","","IEEE","IEEE Journals"
"Parkinson’s Disease Detection by Using Maximal Information Coefficient","W. Pan","School of Applied Mathematics, Xiamen University of Technology, Xiamen, China","2021 IEEE 5th Information Technology,Networking,Electronic and Automation Control Conference (ITNEC)","4 Nov 2021","2021","5","","153","156","In the detection of Parkinson’s disease based on acoustic features, there are a large number of irrelevant and redundant features in the dataset. Feature selection is a necessary data preprocessing method to remove irrelevant features and obtain high classification performance in pattern recognition. The significance of this work is to develop and use a novel method based on the maximal information coefficient (MIC) to measure the classification consistency between features and the decision. Firstly, the maximal information coefficient (MIC) is calculated to get the dependence between each feature and the decision. According to the correlation value, a feature sequence is obtained. Secondly, an optimal feature subset based on the maximal information coefficient (MIC) is selected by combining with a classification learning model. Finally, the designed algorithm is applied for Parkinson’s disease detection. The experimental results demonstrate that the proposed algorithm can effectively reduce the dimension of feature space, select disease-sensitive features, and achieve higher detection accuracy.","2693-3128","978-1-6654-1599-6","10.1109/ITNEC52019.2021.9586843","Xiamen University of Technology; ","https://ieeexplore.ieee.org/stamp/stamp.jsp?arnumber=9586843","Parkinson’s disease;maximal information coefficient;feature selection;voice features","Microwave integrated circuits;Correlation;Parkinson's disease;Conferences;Data preprocessing;Feature extraction;Classification algorithms","","4","","13","IEEE","4 Nov 2021","","","IEEE","IEEE Conferences"
"A Weakly Supervised Learning Framework for Parkinson’s Disease Assessment Using Wearable Sensor","Z. Li; X. Peng; Y. Zhao; X. Wang; Y. Yang; P. Yang","National Pilot School of Software, Yunnan University, Kunming, China; Department of Computer Science, University of Sheffield, Sheffield, UK; National Pilot School of Software, Yunnan University, Kunming, China; Department of Computer Science, University of Sheffield, Sheffield, UK; National Pilot School of Software, Yunnan University, Kunming, China; Department of Computer Science, University of Sheffield, Sheffield, UK","2023 19th International Conference on Mobility, Sensing and Networking (MSN)","26 Jun 2024","2023","","","813","818","Wearable technology has played a crucial role in computer-aided diagnosis and long-term monitoring of Parkinson’s disease (PD). How to efficiently and accurately assess the severity of Parkinson’s disease using wearable devices remains the essential problem. However, in the real free-living environment, we have encountered two issues: weak annotation and class imbalance, which could potentially impede the automatic assessment of Parkinson’s disease. To overcome these challenges, we propose a novel Parkinson’s disease assessment framework in free-living environment. Specifically, clustering methods are used to learn latent categories from the same activities, and use Latent Dirichlet allocation (LDA) topic models to capture latent features of multiple activities. Then, to mitigate the impact of data imbalance, we augment bag-level data while retaining key instance prototypes. The new framework is applied to a PD dataset collected by wearable sensors in the wild. It achieves an impressive 73.49% accuracy in the fine-grained (normal, mild, moderate, severe) classification of PD severity based on hand movements. Overall, this study contributes to more accurate PD self-diagnosis in the wild, enabling remote guidance for drug intervention from doctors.","2994-3523","979-8-3503-5826-1","10.1109/MSN60784.2023.00119","National Natural Science Foundation of China; ","https://ieeexplore.ieee.org/stamp/stamp.jsp?arnumber=10567002","Data Augmentation;Parkinson’s disease;Wearable sensor;Weak annotation","Drugs;Accuracy;Annotations;Supervised learning;Symbols;Medical services;Resource management","","","","21","IEEE","26 Jun 2024","","","IEEE","IEEE Conferences"
"Automatic estimation of severity of Parkinson's disease based on speech rhythm related features","D. Sztahó; M. G. Tulics; K. Vicsi; I. Valálik","Hungarian Academy of Sciences, Budapest, Hungary; Department of Telecommunication and Media Informatics, Budapest University of Technology and Economics; Department of Telecommunication and Media Informatics, Budapest University of Technology and Economics; Department of Neurosurgery, St. John's Hospital, Budapest, Hungary",2017 8th IEEE International Conference on Cognitive Infocommunications (CogInfoCom),"25 Jan 2018","2017","","","000011","000016","Diseases, such as Parkinson, impairs cognitive processes of patients, through which speech is also affected. In this paper, we propose a method for Parkinson's disease severity level estimation based on speech rhythm related features extracted from running speech (read texts and monologue) uttered by Hungarian Parkinson patients and healthy control population. Classification and regression models are built using various machine-learning methods for both linguistic types separately. Separate and joint decisions were made for the different text types. The final prediction was obtained by fusing the separate estimations for each speaker. Test trials were run in order to investigate, if age is a relevant feature for the machine learning tasks. It was found that the investigated features are useful and highly relevant for the automatic diagnosis of Parkinson's disease based on the classification and regression performances. The best results were obtained using support vector machine (and regression) with 84.62% accuracy for binary classification and 0.735 Spearman correlation for Parkinson severity level estimation measured on the Hoehn-Yahr scale.","","978-1-5386-1264-4","10.1109/CogInfoCom.2017.8268208","","https://ieeexplore.ieee.org/stamp/stamp.jsp?arnumber=8268208","Parkinson;speech;signal processing;support vector regression;neural networks;medical informatics","Speech;Estimation;Databases;Parkinson's disease;Rhythm;Support vector machines","","16","","25","IEEE","25 Jan 2018","","","IEEE","IEEE Conferences"
"Inertial BSN-Based Characterization and Automatic UPDRS Evaluation of the Gait Task of Parkinsonians","F. Parisi; G. Ferrari; M. Giuberti; L. Contin; V. Cimolin; C. Azzaro; G. Albani; A. Mauro","CNIT Research Unit of Parma and the Department of Information Engineering, University of Parma, Parma, Italy; CNIT Research Unit of Parma and the Department of Information Engineering, University of Parma, Parma, Italy; Xsens Technologies B.V., 7500 AN Enschede, The Netherlands; Research & Prototyping, Telecom Italia, Turin, Italy; Department of Electronics, Information, and Bioengineering, Polytechnic of Milan, Italy; Division of Neurology and Neurorehabilitation, Istituto Auxologico Italiano IRCCS, Piancavallo (VB), Italy; Division of Neurology and Neurorehabilitation, Istituto Auxologico Italiano IRCCS, Piancavallo (VB), Italy; Division of Neurology and Neurorehabilitation, Istituto Auxologico Italiano IRCCS, Piancavallo (VB), Italy and the Department of Neurosciences, University of Turin, Italy",IEEE Transactions on Affective Computing,"20 May 2017","2016","7","3","258","271","The analysis and assessment of motor tasks, such as gait, can provide important information on the progress of neurological disorders such as Parkinson's disease (PD). In this paper, we design a Boby Sensor Network (BSN)-based system for the characterization of gait in Parkinsonians through the extraction of kinematic features, in both time and frequency domains, embedding information on the status of the PD. The gait features extraction is performed on a set of 34 PD patients using a BSN formed by only three inertial nodes (one on the chest and one per thigh). We investigate also the relationship between the selected kinematic features and the Unified Parkinson's Disease Rating Scale (UPDRS) scores assigned to patients by expert neurologists. This work extends a previously proposed approach to the analysis of leg agility and sit-to-stand tasks and, as such, represents a further step to develop a system for automatic and comprehensive evaluation of different PD motor tasks. A performance analysis of different classification techniques is carried out, showing the feasibility of an automatic (and, eventually, remote) UPDRS scoring system, suitable for tele-health applications in the realm of affective medicine.","1949-3045","","10.1109/TAFFC.2016.2549533","Italian Ministry of Health(grant numbers:RF-2009-1472190); ","https://ieeexplore.ieee.org/stamp/stamp.jsp?arnumber=7445833","Parkinson's disease (PD);gait analysis;unified Parkinson's disease rating scale (UPDRS);inertial measurement units (IMU);tele-health","Feature extraction;Electronic mail;Parkinson's disease;Kinematics;Legged locomotion;Reliability;Frequency-domain analysis","","37","","31","IEEE","1 Apr 2016","","","IEEE","IEEE Journals"
"Classification of Parkinson's Disease using CNN and ANN with the aid of Drawing and Acoustic Feature","S. Fiza; A. Kumar; J. Yadav; S. Reddy; T. K. Sidda; K. Sai","Department of Medical electronics, Dayananda Sagar College of Engineering, Bengaluru, Karnataka, India; Department of Information Technology, Delhi Technological University, Shabad Daulatpur, Delhi, India; Department of Instrumentation and Technology, Netaji Subhas University of Technology, Dwarka, Delhi; Department of civil engineering, Indian institute of technology, Hyderabad, India; Department Of Computer Science and Engineering, Gandhi institute of technology and management, Vishakhapatnam, Andhra Pradesh, India; Department of Computer science and Engineering, Data Analytics Vellore Institute Of Technology, Amaravati, Andhra Pradesh, India",2022 2nd International Conference on Advance Computing and Innovative Technologies in Engineering (ICACITE),"18 Jul 2022","2022","","","513","517","Parkinson's disease manifests itself in a variety of ways. slurred speech, muscle rigidity, and tremors. The condition can also affect the production of the brain's dopamine. Therapies can help treat conditions after a diagnosis, however, there is no remedy. The paper primarily analyses the many drawing evaluation methods and disease diagnoses that have been used. The AI deep learning idea was used, along with convolutional neural networks and artificial neural networks. However, this article proposes a model for detecting disease using drawings of different persons from two classes. Disease detection on photos has been accomplished using a variety of techniques such as data augmentation, sequential, and CNN. The acoustic feature data was processed using a Decision tree and ANN with GridsearchCV, and the overall accuracy on testing data was 98 percent.","","978-1-6654-3789-9","10.1109/ICACITE53722.2022.9823915","","https://ieeexplore.ieee.org/stamp/stamp.jsp?arnumber=9823915","Convolutional neural network;Artificial neural network;GridSearchCV;Decision Tree;Parkinson's disease","Parkinson's disease;Memory management;Production;Muscles;Acoustics;Rigidity;Convolutional neural networks","","4","","28","IEEE","18 Jul 2022","","","IEEE","IEEE Conferences"
