"Ensemble prediction of longitudinal scores of Alzheimer's disease based on ℓ2,1-norm regularized correntropy with spatial-temporal constraint","W. Hou; B. Lei; W. Zou; X. Li; C. Zhang","College of Information Engineering, Shenzhen University, Shenzhen, China; School of Biomedical Engineering, Guangdong Key Laboratory for Biomedical Measurements and Ultrasound Imaging, Shenzhen, China; College of Information Engineering, Shenzhen University, Shenzhen, China; Shenzhen University, Shenzhen, Guangdong, CN; Faculty of Science, Swinburne University of Technology, Australia",2017 IEEE 14th International Symposium on Biomedical Imaging (ISBI 2017),"19 Jun 2017","2017","","","891","894","This paper presents a novel longitudinal framework for clinical score prediction in Alzheimer's disease (AD) diagnosis. In contrast to the previous approaches that use the data collected at a single time point only for the clinical score prediction, we propose to exploit the imaging data of multiple time points. Furthermore, a spatial-temporal group sparse method is proposed for robust feature selection through imposing a fused smoothness term and a locality-preserving-projection based term as well as integrating correntropy into the framework, which is able to promote the prediction consistency and reduce the adverse effect of noises and outliers. Ensemble learning of support vector regression (SVR) is exploited to predict the AD scores more accurately with the selected features. The proposed approach is extensively evaluated on the Alzheimer's disease neuroimaging initiative (ADNI) dataset. The experiments demonstrate that our proposed approach achieves promising regression accuracy.","1945-8452","978-1-5090-1172-8","10.1109/ISBI.2017.7950659","","https://ieeexplore.ieee.org/stamp/stamp.jsp?arnumber=7950659","Alzheimer's Disease;Correntropy;Ensemble Learning;Longitudinal Score Prediction;Spatial-Temporal Constraint","Robustness;Alzheimer's disease;Magnetic resonance imaging;Data models;Predictive models","","2","","28","IEEE","19 Jun 2017","","","IEEE","IEEE Conferences"
"Enhanced Local Feature Extraction for Alzheimer's Diagnosis using Res-VMamba Model","R. Huang","School of Biomedical Engineering, Shanghai Jiao Tong University, Shanghai, China",2025 7th International Conference on Artificial Intelligence Technologies and Applications (ICAITA),"8 Sep 2025","2025","","","180","184","Alzheimer's Disease (AD) is a progressive neurodegenerative disorder that significantly affects memory and cognitive function. Early and accurate diagnosis plays a crucial role in delaying disease progression. Structural MRI imaging is a widely used modality for AD diagnosis due to its non-invasive and high-resolution properties. Although visual backbone architectures such as Visual Transformer and State Space Model (SSM) perform well in image classification tasks, current models still have shortcomings in local feature extraction. To address this challenge, this paper proposes a Res-VMamba model, which is an enhanced SSM architecture that integrates a residual convolutional patch embedding module inspired by the ResNet stem. This module improves local feature extraction by combining multi-scale convolutions, residual connections, and dual max pooling operations. The research evaluates this model on a multiclass MRI-based AD dataset containing three categories: 'Non Demented', 'Very Mild Demented', and 'Mild Demented'. Experimental results demonstrate that Res-VMamba outperforms state-of-the-art CNNs, Transformers, and the original VMamba model in classification accuracy (86.90 %) and F1-score (86.76), confirming the effectiveness of the proposed patch embedding design for fine-grained AD staging tasks. The study provides a more refined pathological identification tool for the diagnosis of $A D$ and has important practical application value.","","979-8-3315-7423-9","10.1109/ICAITA67588.2025.11137840","","https://ieeexplore.ieee.org/stamp/stamp.jsp?arnumber=11137840","Alzheimer's disease;MRI classification;deep learning;Res-VMamba;patch embedding","Deep learning;Visualization;Accuracy;Magnetic resonance imaging;Computational modeling;Computer architecture;Feature extraction;Transformers;Data models;Alzheimer's disease","","","","26","IEEE","8 Sep 2025","","","IEEE","IEEE Conferences"
"Multi-Modal Feature Fusion with Fuzziness based Semi-Supervised Learning for Alzheimer’s Disease Diagnosis","U. H. Bushra; F. Chowdhury Priya; M. J. A. Patwary","Department of Computer Science and Engineering, International Islamic University Chittagong, Chattogram, Bangladesh; Department of Computer Science and Engineering, International Islamic University Chittagong, Chattogram, Bangladesh; Institute of Information & Communication Technology, Chittagong University of Engineering & Technology, Chattogram, Bangladesh","2024 IEEE International Conference on Computing, Applications and Systems (COMPAS)","19 Dec 2024","2024","","","1","6","Alzheimer’s disease is a prominent kind of dementia that is caused by a slow decline of cognitive abilities, including memory loss, impaired speech and diminished reactivity. The condition primarily affects brain regions responsible for cognition, memory and language and typically becomes apparent after the age of 60, with a greater risk among older individuals. To meet the requirement for early identification, researchers have explored various machine-learning techniques. To enhance the accuracy of diagnosing Alzheimer’s disease, researchers have employed supervised and unsupervised learning approaches derived from machine learning. While supervised learning relies on labelled data, obtaining sufficient labelled samples can be time-consuming and requires specialized assistance. The focus is on multiclass classification, harnessing MRI and PET data. SGLDM and SIFT feature extraction algorithms are utilized to enable the fusion of features from diverse perspectives, resulting in a robust classification model. This research introduces a novel strategy for AD diagnosis, combining multimodal feature fusion with a fuzziness-based-semi-supervised learning method. The method leverages both labeled and mislabeled data to enhance the model’s reliability. The proposed method demonstrated notable enhancements in the classifier’s performance compared to existing approaches on the dataset.","","979-8-3315-2976-5","10.1109/COMPAS60761.2024.10796811","","https://ieeexplore.ieee.org/stamp/stamp.jsp?arnumber=10796811","Alzheimer’s Disease;Multimodality;Feature Level Fusion;Fuzziness;Semi Supervised Learning","Machine learning algorithms;Magnetic resonance imaging;Supervised learning;Machine learning;Semisupervised learning;Feature extraction;Reliability;Medical diagnosis;Alzheimer's disease;Unsupervised learning","","2","","16","IEEE","19 Dec 2024","","","IEEE","IEEE Conferences"
"Variations of white matter tract length in regions of emotional regulation as assessed in alzheimer diffusion tensor images","R. Piyush; S. Ramakrishnan","Biomedical Engineering Group, Indian Institute of Technology, Madras, India; Biomedical Engineering Group, Indian Institute of Technology, Madras, India","2014 International Conference on Informatics, Electronics & Vision (ICIEV)","29 Jun 2015","2014","","","1","4","Alzheimer's disease (AD) is a progressive neurodegenerative disorder which affects various regions of brain. The primary damage occurs in white matter (WM) tracts leading to disintegration and death of neurons. Diffusion tensor imaging is one of the most widely used techniques to study the microstructural changes in WM. In this work, variations in length of WM tracts for regions associated with emotional regulation are studied. The images obtained from ADNI database are pre-processed to remove non-brain tissues and non-rigid registration is performed. Deterministic streamline tractography is used to reconstruct the WM tracts for whole brain. Length of each tract is estimated by voxel counting method. Brodmann area maps are superimposed to extract the tracts for areas 11, 38 and 47. Average tract length of each subregion is compared for AD and normal controls. The results show that there is a reduction in average tract length for AD subjects in the three regions studied. Maximum reduction of 27.15% is observed for area 11 followed by 24.43% for area 38 and 16.31% for area 47. No correlation is observed with MMSE score for any of these three sub-regions. This method of quantification of WM degeneration can be used to assess the severity of AD progression.","","978-1-4799-5180-2","10.1109/ICIEV.2014.7135996","","https://ieeexplore.ieee.org/stamp/stamp.jsp?arnumber=7135996","Alzheimer's disease; Diffusion Tensor Imaging;Deterministic Streamline Tractography; Brodmann Area; WhiteMatter Tract;","Alzheimer's disease;Tensile stress;Diffusion tensor imaging;Streaming media;Image reconstruction","","","","20","IEEE","29 Jun 2015","","","IEEE","IEEE Conferences"
"Deep Learning Approaches for Early Detection of Alzheimer's Disease using MRI Neuroimaging","M. S. Bhargavi; B. Prabhakar","Department of Computer Science and Engineering, Bangalore Institute of Technology, Bengaluru, India; Department of Computer Science and Engineering, Bangalore Institute of Technology, Bengaluru, India",2022 International Conference on Connected Systems & Intelligence (CSI),"1 Nov 2022","2022","","","1","6","Alzheimer's disease is a neurodegenerative disorder and one of the most prevalent forms of progressive Dementia. Alzheimer's disease does not have any cure as it leads to brain shrinkage and damage of the brain cells. Early detection can aid in assessing and administering suitable treatment that can slow down disease progression. Progressive monitoring of individuals diagnosed with Mild Cognitive Impairment (MCI) through neuroimaging has gained considerable interest recently for early detection. The most popular neuroimaging used being the Magnetic Resonance Imaging (MRI). The intention of monitoring individuals diagnosed with MCI is that, MCI diagnosed are more likely to get converted to Alzheimer's. Deep learning models have proven to be very effective and shown powerful performance in neuroimaging analytics. Deep learning techniques have been employed over brain MRI for assessing Alzheimer's disease progression and gained immense popularity in recent times due to its commendable performance. In this paper, we present a study on the applications of Deep learning techniques in early detection and progression of Alzheimer's disease. The study focuses on recent advances in the early detection of Alzheimer's using Deep learning models and MRI neuroimaging.","","978-1-6654-5815-3","10.1109/CSI54720.2022.9924058","","https://ieeexplore.ieee.org/stamp/stamp.jsp?arnumber=9924058","Alzheimer's Disease;Neuroimaging;Magnetic Resonance Imaging;Deep Learning;Mild Cognitive Impairment","Deep learning;Neuroimaging;Solid modeling;Three-dimensional displays;Magnetic resonance imaging;Feature extraction;Genetics","","7","","28","IEEE","1 Nov 2022","","","IEEE","IEEE Conferences"
"Deep Learning for Alzheimer's Disease Classification: CNN Model Using MRI Images","Bhoomika; M. Manu; J. Lande; G. Verma","Chitkara University Institute of Engineering and Technology, Chitkara University, Punjab, India; Graphic Era Hill University, Bhimtal; School of Computer Science & Artificial Intelligence, SR University, Warangal; Chitkara University Institute of Engineering and Technology, Chitkara University, Punjab, India",2024 International Conference on Information Science and Communications Technologies (ICISCT),"14 Apr 2025","2024","","","464","468","Early discovery of Alzheimer's disease is important for efficient intervention and management since it is a degenerative brain illness that seriously affects cognitive abilities. This work directs to build a CNN model to categorise several phases of Alzheimer's disease depending on MRI data. Drawn from the open-source Kaggle platform, the dataset consists of 6,400 MRI scans separated into four classes. The images were homogeneous pre-processed CNN model training and validation then followed from this. The algorithm showed to be really good in spotting Alzheimer's phases in class with an incredible 99% accuracy. Showing great accuracy, recall, and F1-scores across all categories, the classification report presents a well-balanced and well- performing model. Furthermore, showing low misclassifications in the confusion matrix emphasises the model's capacity to span the several phases of Alzheimer's. The findings show CNN's promise in automated Alzheimer's detection, providing a consistent, non-invasive instrument for early diagnosis and so improving patient care and treatment planning.","","979-8-3315-2792-1","10.1109/ICISCT64202.2024.10956717","","https://ieeexplore.ieee.org/stamp/stamp.jsp?arnumber=10956717","Artificial Intelligence;Deep Learning;Alzheimer MRI Classification;Model Training;CNN Model","Deep learning;Training;Accuracy;Magnetic resonance imaging;Brain modeling;Robustness;Real-time systems;Planning;Alzheimer's disease;Monitoring","","","","14","IEEE","14 Apr 2025","","","IEEE","IEEE Conferences"
"Exploring Network Topology-Based Methods to Differentiate Healthy and Alzheimer's Cohorts: An EEG-Based Study","P. Singh; L. Kumar; T. K. Gandhi","Bharti School of Telecommunication Technology and Management, Indian Institute of Technology, Delhi, India; Bharti School of Telecommunication Technology and Management, Indian Institute of Technology, Delhi, India; Bharti School of Telecommunication Technology and Management, Indian Institute of Technology, Delhi, India",2024 32nd European Signal Processing Conference (EUSIPCO),"23 Oct 2024","2024","","","1576","1580","Functional connectivity and network topology dif-ferences between 23 Alzheimer's disease (AD) patients and 23 healthy subjects were studied using resting state electroen-cephalography (EEG) data. FC across different pairs of EEG channels were obtained using two different metrics: the phase lag index (PLI) and the phase locking value (PLV). MSTs were generated using PLI-weighted networks. We also explored the hierarchical clustering organization of these MSTs. Finally, we employed MST topology network metrics to classify Alzheimer's and healthy groups using Support Vector Machine (SVM), Decision Tree (DT), and Random Forest (RF) classifiers. Our analysis revealed frequency -dependent functional connectivity patterns. Specifically, in the alpha 1 band, Alzheimer's patients exhibited lower network topology metrics, whole-brain PLI, and regional PLI compared to the healthy group. MST analysis further indicated a loss of network organization, particularly in posterior regions, in AD patients. Our results suggest that DT and RF classifiers are most suitable for distinguishing between AD and healthy cohorts using MST network topology measures.","2076-1465","978-9-4645-9361-7","10.23919/EUSIPCO63174.2024.10714977","","https://ieeexplore.ieee.org/stamp/stamp.jsp?arnumber=10714977","Alzheimer's;Functional connectivity;MST","Radio frequency;Support vector machines;Measurement;Network topology;Organizations;Electroencephalography;Topology;Decision trees;Alzheimer's disease;Random forests","","","","24","","23 Oct 2024","","","IEEE","IEEE Conferences"
"Spatial regularization for neural network and application in Alzheimer's disease classification","X. Yang; Q. Wu; D. Hong; J. Zou","Department of Math and Computer Science, Southern Arkansas University, Magnolia, Arkansas, USA; Department of Mathematical Sciences, Middle Tennessee State University, Murfreesboro, Tennessee, USA; Department of Mathematical Sciences, Middle Tennessee State University, Murfreesboro, Tennessee, USA; College of Sciences, North China University of Technology, Beijing, China",2016 Future Technologies Conference (FTC),"19 Jan 2017","2016","","","831","837","Since the computer hardware power has been improved, neural networks have been widely applied in different fields. However, to the best of our knowledge, the idea of coding spatial information for Alzheimer's disease classification in the regularization neural network context is still new. This motivation has led us to propose a spatial regularization approach for neural network and apply it to structural MRI Alzheimer's disease classification. We tested our proposed model on two types of data. Real application results show that spatial regularization neural network increase the classification accuracy.","","978-1-5090-4171-8","10.1109/FTC.2016.7821700","","https://ieeexplore.ieee.org/stamp/stamp.jsp?arnumber=7821700","Neural Network;Spatial Regularization;Alzheimer's disease","Biological neural networks;Alzheimer's disease;Magnetic resonance imaging;Data models;Feature extraction","","3","","37","IEEE","19 Jan 2017","","","IEEE","IEEE Conferences"
"Deep Learning Tactics for Neuroimaging Genomics Investigations in Alzheimer's Disease","M. S. Rajput; J. Shah; V. Patel; N. S. Rajput; D. Kumar","Department of Pharmacology, Institute of Pharmacy, Nirma University, Ahmedabad, Gujarat, India; Department of Pharmacology, Institute of Pharmacy, Nirma University, Ahmedabad, Gujarat, India; Department of Pharmaceutics, Ramanbhai Patel College of Pharmacy, Charotar University of Science and Technology (CHARUSAT), Changa, Gujarat, India; Department of Information and Communication Technology, School of Technology, Pandit Deendayal Energy University, Gandhinagar, Gujarat, India; Poona College of Pharmacy, Department of Pharmaceutical Chemistry, Bharati Vidyapeeth (Deemed to be University), Pune, Maharashtra, India",Artificial Intelligence and Machine Learning in Drug Design and Development,"","2024","","","451","471","Summary <p>Alzheimer's disease (AD) is a neurodegenerative condition that is hallmarked by senile dementia, worsens over time, and has no proven treatment. It causes a decline in cognitive abilities. Effective automated procedures are required for early prediction and diagnosis since it is imperative to stop the progression of the disease. The creation of precise computer diagnostic systems was made possible by the nature of several aspects of neural data, which were primarily retrieved from neuroimaging with computer‐aided algorithms. In the field of computer vision, deep learning, a high‐tech machine learning strategy, has demonstrated exceptional ability in identifying detailed structures in complicated, high‐dimensional data. Presently, a rising body of research suggests that deep learning techniques can act as a crucial pillar for the diagnosis, categorization, and prediction of AD. In order to develop targeted therapies, it is crucial to comprehend the genetic aetiology of AD. Several researchers had tried to find possible biomarkers for future therapy by using machine learning techniques to analyze the expressed genes in AD patients. Technology advancements in genomic research, like genome‐wide association studies (GWAS), which enable the identification of polymorphisms and have been extensively used in investigations of AD, have identified certain genes as significant clinical risk factors for AD. In addition, a number of deep learning models are currently being used in research investigations to distinguish AD from normal controls and/or to distinguish AD from mild cognitive impairment in light of the most recent developments in neuroimaging and genetics. The chapter enlightens many studies that apply deep learning algorithms to predict AD using genomes or neuroimaging data along with the supportive tactics. On the basis of combining both neuroimaging and genome data, pertinent integrative neuroimaging genomics studies that make use of deep learning techniques to forecast AD have been discussed. The limitations of the most recent deep learning combined with neuroimaging and genomics AD investigations have also been described. Lastly, a summary of the research findings, challenges, and future directions for integrating deep learning methods into therapeutic settings is deliberated.</p>","","9781394234189","10.1002/9781394234196.ch14","","https://ieeexplore.ieee.org/xpl/ebooks/bookPdfWithBanner.jsp?fileName=10952872.pdf&bkn=10950227&pdfType=chapter","","Genomics;Diseases;Deep learning;Bioinformatics;Neuroimaging;Alzheimer's disease;Genetics;Proteins;Machine learning;Stress","","","","","","8 Apr 2025","","","Wiley","Wiley AI eBook Chapters"
"Advances in Alzheimer's Detection: A Multi-Learning Fusion Approach Using Choroidal Neovascularization Analysis","P. Udayaraju; P. Jeyanthi","Department of CSE, Sathyabama Institute of Science and Technology, Chennai; Department of IT, Sathyabama Institute of Science and Technology, Chennai",2024 International Conference on IoT Based Control Networks and Intelligent Systems (ICICNIS),"10 Jan 2025","2024","","","1497","1503","Alzheimer's disease (AD) is one of the brain disorders diseases that have a significant impact on the daily life of an affected person. Recently, several studies have revealed that there is a strong connection between several retinal and choroidal pathologies, such as Choroidal Neovascularization (CNV), which leads to AD. This research mainly focused on detecting AD from CNV via optical coherence tomography (OCT) images. OCT is used primarily to diagnose retinal diseases, as it provides high-resolution images of retinal layers and highlights the abnormalities present in the retinal images, which leads to CNV. Linking the CNV with retinal features of Alzheimer's requires unique techniques and analysis, as these two brains and eyes are interconnected by sharing the vascular and neural systems. In this work, the pre-trained model ResNET-101 with transfer learning is used to find the abnormal patterns belonging to AD using OCT images. The proposed Multi-Learning Fusion Model (MLFM) combines residual layers with Xtensible Convolutional Neural Networks (X-CNNs), which detect abnormalities from OCT images. In this context, the training model's residual layers transform the features of vascular and neural systems. Furthermore, the MLFM exhibits high sensitivity in detecting subtle choroidal changes associated with AD progression. Finally, the quantitative results show that the proposed MLFM obtains an accuracy of 99.78% with accurate abnormal region detection.","","979-8-3315-1809-7","10.1109/ICICNIS64247.2024.10823111","","https://ieeexplore.ieee.org/stamp/stamp.jsp?arnumber=10823111","Alzheimer's disease (AD);Choroidal Neovascularization (CNV);Coherence Tomography (OCT);Multi-Learning Fusion Model (MLFM);ResNET-101;Transfer Learning","Pathology;Wiener filters;Accuracy;Noise;Transfer learning;Transforms;Retina;Brain modeling;Convolutional neural networks;Alzheimer's disease","","","","21","IEEE","10 Jan 2025","","","IEEE","IEEE Conferences"
"Synchrony analysis of spontaneous MEG activity in Alzheimer's disease patients","C. Gómez; M. Martínez-Zarzuela; J. Poza; F. J. Díaz-Pernas; A. Fernández; R. Hornero","Biomedical Engineering Group at Department of Signal Theory and Communications, E.T.S.Ingenieros de Telecomunicación, University of Valladolid, Valladolid, Spain; Industrial Telematics Group, University of Valladolid, Spain; Biomedical Engineering Group at Department of Signal Theory and Communications, E.T.S.Ingenieros de Telecomunicación, University of Valladolid, Valladolid, Spain; Industrial Telematics Group, University of Valladolid, Spain; Centre for Biomedical Technology, Technical University of Madrid, Spain; Biomedical Engineering Group at Department of Signal Theory and Communications, E.T.S.Ingenieros de Telecomunicación, University of Valladolid, Valladolid, Spain",2012 Annual International Conference of the IEEE Engineering in Medicine and Biology Society,"10 Nov 2012","2012","","","6188","6191","The aim of this study was to analyze the magnetoencephalography (MEG) background activity in Alzheimer's disease (AD) patients using cross-approximate entropy (Cross-ApEn). Cross-ApEn is a nonlinear measure of asynchrony between time series. Five minutes of recording were acquired with a 148-channel whole-head magnetometer in 12 AD patients and 12 age-matched control subjects. We found significantly higher synchrony between MEG signals from AD patients compared with control subjects. Additionally, we evaluated the ability of Cross-ApEn to discriminate these two groups using receiver operating characteristic (ROC) curves with a leave-one-out cross-validation procedure. We obtained an accuracy of 70.83% (66.67% sensitivity, 75% specificity) and a value of area under the ROC curve of 0.83. These results provide evidence of disconnection problems in AD. Our findings show the usefulness of Cross-ApEn to detect the brain dysfunction in AD.","1558-4615","978-1-4577-1787-1","10.1109/EMBC.2012.6347407","","https://ieeexplore.ieee.org/stamp/stamp.jsp?arnumber=6347407","","Entropy;Alzheimer's disease;Electroencephalography;Time series analysis;Synchronization;Magnetic recording","Aged;Alzheimer Disease;Case-Control Studies;Female;Humans;Magnetoencephalography;Male;Middle Aged;ROC Curve","4","","16","IEEE","10 Nov 2012","","","IEEE","IEEE Conferences"
