"Aided Diagnosis of Alzheimer's Disease Based on Structural Magnetic Resonance Imaging","X. Liu; Y. Wang; C. Fu; H. Xiao; S. Xing","School of Computer and Information Engineering, Beijing Technology and Business University, Beijing, China; School of Computer and Information Engineering, Beijing Technology and Business University, Beijing, China; School of Computer and Information Engineering, Beijing Technology and Business University, Beijing, China; School of Computer and Information Engineering, Beijing Technology and Business University, Beijing, China; School of Computer and Information Engineering, Beijing Technology and Business University, Beijing, China",2019 6th International Conference on Systems and Informatics (ICSAI),"27 Feb 2020","2019","","","1201","1206","With the vigorous development of computer and pattern recognition technologies, using magnetic resonance imaging (MRI) and machine learning methods to assist diagnosis of Alzheimer's disease (AD) has became a research hotspot. A new method based on Support Vector Machine-Recursive Feature Elimination (SVM-RFE) and Linear Discriminant Analysis (LDA) for aided diagnosis of AD is proposed in this study. Firstly, Structural MRI images including 34 patients with AD, 26 subjects with subjective memory complaints (SMC) and 50 normal controls (NC) from the ADNI database are preprocessed to obtain the gray matter volumes of 90 brain regions. Then the fusion idea on SVM-RFE and LDA is used to select the characteristics on the above gray matter volumes. Finally, the selected features are classified by support vector machine (SVM), and the average classification accuracies of AD/NC, AD/SMC and NC/SMC reach respectively 94%, 100% and 93.6%. Compared with SVM-RFE or LDA alone, the average classification results on the fusion idea have obvious advantages. The above experimental results show that the proposed method can effectively extract features and assist doctors for exact diagnosis of AD and SMC.","","978-1-7281-5256-1","10.1109/ICSAI48974.2019.9010118","","https://ieeexplore.ieee.org/stamp/stamp.jsp?arnumber=9010118","Alzheimer's disease;structural magnetic resonance imaging;machine learning;feature recursive elimination;linear discriminant analysis","Feature extraction;Support vector machines;Grey matter;Magnetic resonance imaging;Diseases;Training;Testing","","","","21","IEEE","27 Feb 2020","","","IEEE","IEEE Conferences"
"A Holistic Approach to Multimodal Brain Disease Diagnosis in Imbalanced Data","H. B. Rithik; K. S. Abhiman; V. S. P. Kumar; V. Ramanan; M. Balakrishnan","Dept. of Information Technology, Sri Eshwar College of Engineering, Coimbatore, India; Dept. of Information Technology, Sri Eshwar College of Engineering, Coimbatore, India; Dept. of Information Technology, Sri Eshwar College of Engineering, Coimbatore, India; Dept. of Information Technology, Sri Eshwar College of Engineering, Coimbatore, India; Dept. of Information Technology, Sri Eshwar College of Engineering, Coimbatore, India",2024 International Conference on Science Technology Engineering and Management (ICSTEM),"25 Jun 2024","2024","","","1","5","Prediction in large-scale dataset processing involves feature extraction; the problem lies in the inaccuracy of feature extraction and classification from data sets. Our approach to the issue is to use Convolutional Neural Networks (CNNs), which are efficient in feature extraction and classification. A critical step in the classification process is feature selection and extraction. must consider feature selection and extraction to boost efficiency and produce better categorization. As such, figuring out the precise outcome might be straightforward. As Alzheimer's disease progresses, individuals may find it difficult to complete everyday chores, lose the ability to identify loved ones, and suffer severe cognitive impairment. The impact of this disease extends beyond the individual, placing emotional and practical burdens on their families and caregiver","","979-8-3503-7691-3","10.1109/ICSTEM61137.2024.10561077","","https://ieeexplore.ieee.org/stamp/stamp.jsp?arnumber=10561077","Convolutional Neural Networks (CNNs);Alzheimer's disease;3D ResNet;Medial temporal lobe;Deep learning;Early stage detection and diagnosis","Deep learning;Transforms;Feature extraction;Convolutional neural networks;Medical diagnosis;Alzheimer's disease;Bioinformatics","","","","5","IEEE","25 Jun 2024","","","IEEE","IEEE Conferences"
"Prediction and Classification of Alzheimer’s Disease using Machine Learning Techniques in 3D MR Images","K. N. Rao; B. R. Gandhi; M. V. Rao; S. Javvadi; S. S. Vellela; S. Khader Basha","Dept. of CSE, Chalapathi Institute of Technology, Guntur, AP, India; Dept. of CSE, Chalapathi Institute of Technology, Guntur, AP, India; Dept. of CSE, Chalapathi Institute of Technology, Guntur, AP, India; Dept. of CSE, Chalapathi Institute of Technology, Guntur, AP, India; Dept. of CSE, Chalapathi Institute of Technology, Guntur, AP, India; Dept. of CSE, Chalapathi Institute of Technology, Guntur, AP, India",2023 International Conference on Sustainable Computing and Smart Systems (ICSCSS),"7 Jul 2023","2023","","","85","90","Memory and thought-related brain cells are damaged permanently by Alzheimer's disease. It has a fatal outcome since it causes death. As a result, early detection of Alzheimer's disease is of utmost importance. Identifying this condition accurately in its initial stages is critical for both patient care and clinical research. As one of the most expensive diseases to treat, Alzheimer's Disease (AD) has drawn the attention of many researchers, who are working towards creating an automated algorithm with high accuracy. It might be challenging to recognize and forecast Alzheimer's disease in its earliest stages. This issue can be resolved by an ML system that can forecast the disease. Machine Learning (ML) has recently gained enormous popularity for its ability to solve issues in variety of domains, including the interpretation of medical imaging. To forecast and categorize Alzheimer's disease, present-day studies utilize 3D Magnetic Resonance Imaging (MRI) scans and machine learning algorithms. This study combines white and grey matter present in MRI images using 3D MRI technology, and subsequently obtains 2D slices in the coronal, sagittal, and axial orientations. After selecting the most relevant slices, feature extraction is performed using Multi-Layer Perceptron (MLP) and SVM methods for predicting and classifying Alzheimer's disease. The researchers assess the system's efficacy using metrics such as Precision, Recall, Accuracy, and F1-Score.","","979-8-3503-3360-2","10.1109/ICSCSS57650.2023.10169550","","https://ieeexplore.ieee.org/stamp/stamp.jsp?arnumber=10169550","Alzheimer’s disease (AD);MRI (Magnetic Resonance Imaging);SVM (Support Vector Machine);Machine Learning (ML)","Training;Productivity;Three-dimensional displays;Machine learning algorithms;Magnetic resonance imaging;Support vector machine classification;Machine learning","","53","","9","IEEE","7 Jul 2023","","","IEEE","IEEE Conferences"
"Poster: LLM-Based Extraction of Fluid Biomarkers for Alzheimer’s Disease Knowledge Base","J. Sammartino; E. Chianumba; H. Liu","Montclair State University, Montclair, New Jersey, USA; Montclair State University, Montclair, New Jersey, USA; Montclair State University, Montclair, New Jersey, USA","2025 IEEE/ACM Conference on Connected Health: Applications, Systems and Engineering Technologies (CHASE)","19 Aug 2025","2025","","","480","481","Alzheimer’s Disease (AD) diagnosis relies heavily on the identification and interpretation of various biomarkers. This research presents a novel framework for creating a comprehensive biomarker knowledge database for AD using Large Language Models. Our approach integrates advanced Natural Language Processing techniques with multiple state-of-the-art LLMs to extract, validate, and categorize biomarker information from clinical trials and medical literature. We demonstrate the effectiveness of our methodology through preliminary results in Named-Entity-Recognition. The pro-posed system aims to standardize biomarker terminology, establish relationship networks between biomarkers and clinical outcomes, and provide healthcare professionals with an accessible query-based interface to access AD biomarker research.","2832-2975","979-8-4007-1539-6","","","https://ieeexplore.ieee.org/stamp/stamp.jsp?arnumber=11120883","alzheimers disease;biomarkers;large language models;natural language processing","Fluids;Databases;Terminology;Large language models;Knowledge based systems;Medical services;Biomarkers;Natural language processing;Alzheimer's disease;Medical diagnostic imaging","","","","7","","19 Aug 2025","","","IEEE","IEEE Conferences"
"Harmonic Symphony of Prediction: Unveiling a Melodic Ensemble Model for Alzheimer's Disease Prophecy","A. K; N. Sharma","Department of Mathematics, Chandigarh University, Gharuan-Mohali, Punjab, India; Department of Computer Science and Engineering, Chandigarh University, Gharuan-Mohali, Punjab, India","2024 MIT Art, Design and Technology School of Computing International Conference (MITADTSoCiCon)","2 Jul 2024","2024","","","1","6","One neurodegenerative illness that presents a serious threat to world health is Alzheimer's disease (AD). Prompt and precise AD prediction is essential for prompt intervention and better patient outcomes. In this study, we provide an ensemble model that forecasts this disease by using the advantages of three powerful machine learning algorithms: Gradient Boosting, Random Forest, and Logistic Regression. The ensemble model combines these algorithms' various forecasting powers to improve performance. The ensemble architecture aims to maximize each model's unique strengths while limiting overfitting risk and making up for any shortcomings. In addition, we dissect each algorithm's unique contribution within the ensemble to reveal their synergistic benefits. The results reveal that our technique is successful in predicting Alzheimer's disease, with an amazing 92% accuracy rate. In addition to achieving high accuracy, the suggested ensemble model demonstrates resilience and interpretability, two qualities that are essential for the clinical use of predictive models. In pursuing better patient care, our research highlights the promise of combined modeling as a viable means of raising the preciseness of Alzheimer's illness prediction and opening the door to early identification and intervention.","","979-8-3503-6287-9","10.1109/MITADTSoCiCon60330.2024.10574949","","https://ieeexplore.ieee.org/stamp/stamp.jsp?arnumber=10574949","Alzheimer’s Disease;Healthcare;Machine Learning;Ensemble;Artificial Intelligence","Logistic regression;Machine learning algorithms;Accuracy;Limiting;Computational modeling;Predictive models;Prediction algorithms","","2","","23","IEEE","2 Jul 2024","","","IEEE","IEEE Conferences"
"Integrating Stable diffusion for Improved Alzheimer's Disease Classification: Insights from MRI Images and YOLOv8","J. Islam; E. N. Furqon; I. Farady; J. S. Rani Alex; C. -C. Kuo; C. -Y. Lin","National Central University, Taiwan; Yuan Ze University, Taiwan; National Central University, Taiwan; Vellore Institute of Technology, India; National Center for High-Performance Computing, National Applied Research Laboratories, Taiwan; National Central University, Taiwan",2024 International Conference on Consumer Electronics - Taiwan (ICCE-Taiwan),"18 Sep 2024","2024","","","303","304","Alzheimer's disease (AD) is the most common form of dementia, characterized by progressive neurodegeneration. Structural changes in the brain associated with AD can be visualized using magnetic resonance imaging (MRI). However, acquiring a sufficient number of MRI images from patients with Alzheimer's disease is challenging. In this study, we employ stable diffusion to simulate MRI scans of patients with AD. We train the stable diffusion model from scratch to generate new MRI images as part of data augmentation alongside the original images. The model is capable of producing synthetic MRI images of AD. We employ t-distributed Stochastic Neighbor Embedding (t-SNE) visualization to evaluate the quality and diversity of the generated images by comparing their distribution to that of actual MRI scans. Subsequently, a modified YOLOv8-cls model is retrained using the generated images for AD classification. Our findings demonstrate that this approach effectively produces realistic synthetic biological images suitable for training deep learning models with 10% improvement in accuracy.","2575-8284","979-8-3503-8684-4","10.1109/ICCE-Taiwan62264.2024.10674478","National Science and Technology Council; ","https://ieeexplore.ieee.org/stamp/stamp.jsp?arnumber=10674478","Generative model;stable diffusion;Alzheimer’s disease;MRI image;deep learning","Deep learning;Training;Solid modeling;Accuracy;Three-dimensional displays;Generative AI;Magnetic resonance imaging","","","","5","IEEE","18 Sep 2024","","","IEEE","IEEE Conferences"
"Relationship Induced Multi-Template Learning for Diagnosis of Alzheimer’s Disease and Mild Cognitive Impairment","M. Liu; D. Zhang; D. Shen","Nanjing University of Aeronautics and Astronautics, School of Computer Science and Technology, Nanjing, China; Nanjing University of Aeronautics and Astronautics, School of Computer Science and Technology, Nanjing, China; Department of Brain and Cognitive Engineering, Korea University, Seoul, Republic of Korea",IEEE Transactions on Medical Imaging,"30 May 2016","2016","35","6","1463","1474","As shown in the literature, methods based on multiple templates usually achieve better performance, compared with those using only a single template for processing medical images. However, most existing multi-template based methods simply average or concatenate multiple sets of features extracted from different templates, which potentially ignores important structural information contained in the multi-template data. Accordingly, in this paper, we propose a novel relationship induced multi-template learning method for automatic diagnosis of Alzheimer's disease (AD) and its prodromal stage, i.e., mild cognitive impairment (MCI), by explicitly modeling structural information in the multi-template data. Specifically, we first nonlinearly register each brain's magnetic resonance (MR) image separately onto multiple pre-selected templates, and then extract multiple sets of features for this MR image. Next, we develop a novel feature selection algorithm by introducing two regularization terms to model the relationships among templates and among individual subjects. Using these selected features corresponding to multiple templates, we then construct multiple support vector machine (SVM) classifiers. Finally, an ensemble classification is used to combine outputs of all SVM classifiers, for achieving the final result. We evaluate our proposed method on 459 subjects from the Alzheimer's Disease Neuroimaging Initiative (ADNI) database, including 97 AD patients, 128 normal controls (NC), 117 progressive MCI (pMCI) patients, and 117 stable MCI (sMCI) patients. The experimental results demonstrate promising classification performance, compared with several state-of-the-art methods for multi-template based AD/MCI classification.","1558-254X","","10.1109/TMI.2016.2515021","NUAA Fundamental Research Funds(grant numbers:NE2013105); Jiangsu Natural Science Foundation for Distinguished Young Scholar(grant numbers:BK20130034); Specialized Research Fund for the Doctoral Program of Higher Education(grant numbers:20123218110009); National Institutes of Health(grant numbers:AG041721,AG042599,EB006733,EB008374,EB009634,MH100217); National Natural Science Foundation of China(grant numbers:61422204,61473149,61473190); ","https://ieeexplore.ieee.org/stamp/stamp.jsp?arnumber=7372483","Alzheimer's disease;ensemble classification;multi-template representation;sparse feature selection","Brain;Feature extraction;Support vector machines;Alzheimer's disease;Magnetic resonance imaging;Sociology","Alzheimer Disease;Brain;Cognitive Dysfunction;Humans;Image Interpretation, Computer-Assisted;Machine Learning;Magnetic Resonance Imaging;Neuroimaging;Support Vector Machine","180","1","65","IEEE","5 Jan 2016","","","IEEE","IEEE Journals"
"Multi-Model Deep Learning Fusion for Improved Alzheimer’s Disease Classification with MRI and Cognitive Data","M. I. S. W. Benjamin; K. Maithili; E. Chandralekha; D. Gowtham; S. A. K. Reddy; K. D. Teja","Department of Computer Science & Engineering, Vel Tech Rangarajan Dr.Sagunthala R&D Institute of Science and Technology, Chennai, India; Department of Computer Science & Engineering, Vel Tech Rangarajan Dr.Sagunthala R&D Institute of Science and Technology, Chennai, India; Department of Computer Science & Engineering, Vel Tech Rangarajan Dr.Sagunthala R&D Institute of Science and Technology, Chennai, India; Department of Artificial Intelligence and Data Science, Vel Tech Rangarajan Dr.Sagunthala R&D Institute of Science and Technology, Chennai, India; Department of Artificial Intelligence and Data Science, Vel Tech Rangarajan Dr.Sagunthala R&D Institute of Science and Technology, Chennai, India; Department of Artificial Intelligence and Data Science, Vel Tech Rangarajan Dr.Sagunthala R&D Institute of Science and Technology, Chennai, India",2024 Asian Conference on Intelligent Technologies (ACOIT),"2 Apr 2025","2024","","","1","5","Given its increasing impact and enormous global societal impact, Alzheimer’s disease (AD) presents a serious issue in the healthcare industry. Effective therapies and management techniques for AD depend on early detection and a precise diagnosis. On the other hand, traditional diagnostic approaches frequently depend on expensive imaging methods and arbitrary clinical judgments, which causes delays in diagnosis and less than ideal results. By utilizing MRI scans and handwriting samples, the suggested strategy embraces the ability of multi-modal data integration to offer a novel perspective to AD prediction. A non-invasive and economical method of identifying minor motor and cognitive problems suggestive of early-stage $A D$ is handwriting analysis, whereas MRI offers important insights into the structural brain abnormalities linked to AD. To rigorously pre-process and extract significant features from MRI and handwriting data, state-of-the-art deep learning techniques are used. A multimodal neural network architecture is then fed these features for combined analysis and prediction. Accuracy rates of $\mathbf{8 8 \%}$ for handwriting data and $\mathbf{9 0} \%$ for MRI images are attained by each independently trained model. A unified classifier is then used to aggregate the outputs of different models and refine the categorization through the addition of denser layers A remarkable $\mathbf{9 7 \%}$ accuracy on the test set is achieved by this combined model, which considerably improves diagnostic accuracy. The technique provides a comprehensive approach to AD prediction by combining structural and functional information from MRI with handwriting data, enabling early detection and individualized treatment plans. In order to create robust and trustworthy diagnostic tools, the results emphasize how crucial it is to integrate many data modalities and use deep learning approaches.","","979-8-3503-7495-7","10.1109/ACOIT62457.2024.10939807","","https://ieeexplore.ieee.org/stamp/stamp.jsp?arnumber=10939807","(Alzheimer’s disease;Deep learning;handwriting analysis;MRI;Multi-modal data integration)","Deep learning;Accuracy;Magnetic resonance imaging;Data integration;Feature extraction;Motors;Data models;Alzheimer's disease;Biological neural networks;Resilience","","","","10","IEEE","2 Apr 2025","","","IEEE","IEEE Conferences"
"Hybrid Deep Learning Architecture for Accurate Classification of Alzheimer’s Disease using MRI Images","N. B. Balakrishnan; A. S. Pillai; J. J. Panackal","Department of Computer Application, Hindustan Institute of Technology and Science, Chennai, Tamilnadu, India; Department of Computer Application, Hindustan Institute of Technology and Science, Chennai, Tamilnadu, India; Department of Computer Application, Sacred Heart College, Kerala, India","2024 8th International Conference on Electronics, Communication and Aerospace Technology (ICECA)","24 Dec 2024","2024","","","345","351","Alzheimer’s Disease (AD) is a progressive neurodegenerative disorder characterized by cognitive decline and memory loss. Precise and timely identification of this condition is significant for proper treatment. Magnetic Resonance Imaging (MRI) is a widely employed technology for analyzing brain structures and identifying abnormalities interconnected with AD. The recent advancements in medical fields, including the introduction of Deep Learning (DL) approaches, have automated the AD diagnosis process. However, achieving high accuracy remains a challenge due to the complexity and heterogeneity of AD manifestations. In this proposed work, we introduce a novel hybrid deep learning architecture designed to improve the accuracy of AD classification. The proposed architecture combines the strengths of convolutional neural networks (CNNs) for feature extraction and Autoencoder for capturing temporal dependencies in sequential MRI scans. Utilizing the Dragonfly optimization technique for fine-tuning the parameters and hyperparameters of deep learning models utilized in AD classification. The developed strategy was trained and validated using the publicly available AD and Munich databases. The proposed method achieved an overall accuracy of $98.34 \%$, precision of $99.06 \%$, recall of $99.65 \%$, and f-measure of $99.90 \%$. We anticipate that the proposed hybrid architecture will improve AD classification models’ discriminative power and robustness, thereby offering early and accurate diagnosis of this debilitating disease.","","979-8-3503-6790-4","10.1109/ICECA63461.2024.10800913","","https://ieeexplore.ieee.org/stamp/stamp.jsp?arnumber=10800913","Alzheimer’s Disease;Dragonfly optimization;Autoencoder;convolutional neural network","Deep learning;Brain;Accuracy;Recurrent neural networks;Magnetic resonance imaging;Autoencoders;Refining;Robustness;Alzheimer's disease;Optimization","","","","15","IEEE","24 Dec 2024","","","IEEE","IEEE Conferences"
"Transfer learning approach for Alzheimer’s disease diagnosis using MRI images","A. R. Zouaoui; Y. Brik; B. Attallah; M. Djeriuoi; M. Belkhelfa","LASS Laboratory, Faculty of Technology, Mohamed Boudiaf University, M’Sila, Algeria; LASS Laboratory, Faculty of Technology, Mohamed Boudiaf University, M’Sila, Algeria; LASS Laboratory, Faculty of Technology, Mohamed Boudiaf University, M’Sila, Algeria; LASS Laboratory, Faculty of Technology, Mohamed Boudiaf University, M’Sila, Algeria; LASS Laboratory, Faculty of Technology, Mohamed Boudiaf University, M’Sila, Algeria",2022 International Conference of Advanced Technology in Electronic and Electrical Engineering (ICATEEE),"17 Apr 2023","2022","","","1","6","Alzheimer's disease is the most prevalent type of dementia and is defined as a slow-progressing neurological disorder. As a first step, early diagnosis of Alzheimer's disease is crucial, then classification is required as a second step for patients to be offered the most effective treatment available. For testing and analyzing this research, the Alzheimer's Disease Neuroimaging Initiative (ADNI) Baseline dataset is used. In this study, we suggested utilizing a convolutional neural network (CNN) algorithm to diagnose Alzheimer's disease from MRI images using a supervised deep learning approach based on transfer learning. The implemented system examines two different CNN architectures, including VGG-16 and MobileNet-V2. According to our results, this study achieved the highest accuracy and F1-score with 99.71% and 100%, respectively.","","979-8-3503-4674-9","10.1109/ICATEEE57445.2022.10093702","","https://ieeexplore.ieee.org/stamp/stamp.jsp?arnumber=10093702","Deep learning;Transfer learning;Convolutional neural network;Alzheimer’s Disease;Classification;Diagnosis","Neurological diseases;Neuroimaging;Electrical engineering;Deep learning;Magnetic resonance imaging;Transfer learning;Convolutional neural networks","","2","","16","IEEE","17 Apr 2023","","","IEEE","IEEE Conferences"
