"Machine Learning-Based Alzheimer's Disease Prediction using Textual Data","S. Keerthika; S. Priyanka; P. Jayadharshini; V. L. Kowshika; M. Shalini; N. D. Suriya","Department of Artlficial Intelligence, Kongu Engineering College, Erode, India; Department of Artlficial Intelligence, Kongu Engineering College, Erode, India; Department of Artlficial Intelligence, Kongu Engineering College, Erode, India; Department of Artificial Intelligence and Data Science, Kongu Engineering College, Erode, India; Department of Artificial Intelligence and Data Science, Kongu Engineering College, Erode, India; Department of Artificial Intelligence and Data Science, Kongu Engineering College, Erode, India","2023 7th International Conference on Electronics, Communication and Aerospace Technology (ICECA)","9 Feb 2024","2023","","","1180","1185","The use of various machine learning algorithms to analyse text data has increased dramatically in studies into Alzheimer's disease (AD). This overview of the literature examines how sentiment analysis and NLP (Natural Language Processing) are used to comprehend texts about Alzheimer's disease. Tokenization, stop-word removal, as well as lemmatization were used to process more than 500 documents, including academic articles, patient narratives, and carer blogs. While sentiment analysis highlighted the emotional undertones in patient and carer tales, the use of LDA identified the predominate study themes. Key terms associated to Alzheimer's disease were detected via named entity recognition. Significant research findings include early detection and novel therapies, a wide range of emotional expressing in patient and carer texts, and critical terms related to AD. The study highlights future directions and emphasises the possibility for text data analysis to further Alzheimer's disease research as well as patient care.","","979-8-3503-4060-0","10.1109/ICECA58529.2023.10394859","","https://ieeexplore.ieee.org/stamp/stamp.jsp?arnumber=10394859","Text data;Natural Language Processing;Alzheimer's disease (AD);Bayesian methods;Support Vector Machine and Decision Tree;KNN Algorithm;Logistic Regression;Bernoulli Naive Bayes","Support vector machines;Sentiment analysis;Machine learning algorithms;Text recognition;Prediction algorithms;Tokenization;Alzheimer's disease","","4","","20","IEEE","9 Feb 2024","","","IEEE","IEEE Conferences"
"Classification for Alzheimer's disease based on SVM using a spatial texture feature of cortical thickness","S. -L. Wang; Z. -C. Cai; C. -L. Xu","Information Science and Engineering, lanzhou University, lanzhou, China; Information Science and Engineering, lanzhou University, lanzhou, China; Information Science and Engineering, lanzhou University, lanzhou, China",2013 10th International Computer Conference on Wavelet Active Media Technology and Information Processing (ICCWAMTIP),"23 Jan 2014","2013","","","158","161","Features defined on the cortical surface derived from magnetic resonance imaging provide important information to diagnosis the Alzheimer's disease (AD) and its premonitory symptoms Mild Cognitive Impairment (MCI). In general, the methods based on region-wise features poorly reflect the detailed spatial variation of cortical thickness, and those based on vertex-wise features are sensitive to noise. In this paper, we propose an innovative method to describe the spatial texture information of cortical thickness named Spatial Multi-scale Block Local Binary Patterns. And combine this information with the region-wise characters of cortical thickness as the final classification features. The performance based on the proposed method is significantly higher for the AD/NC, AD/MCI and sMCI/cMCI groups than using PCA or taking the average of cortical thickness zones as classification features.","","978-1-4799-2446-2","10.1109/ICCWAMTIP.2013.6716622","","https://ieeexplore.ieee.org/stamp/stamp.jsp?arnumber=6716622","Alzheimer's disease;cortical thickness;SVM;Local Binary Patterns","Feature extraction;Alzheimer's disease;Principal component analysis;Magnetic resonance imaging;Noise;Support vector machine classification","","7","","9","IEEE","23 Jan 2014","","","IEEE","IEEE Conferences"
"Lightweight Network Based on Improved MobileViT for Alzheimer's Disease Prediction","Y. Li; Z. Yang; Z. Ai; R. Xu; Z. Wei; L. Tang","School of Electronic and Electrical Engineering, Wuhan Textile University, Wuhan, China; School of Information Science and Engineering, Wuhan University of Science and Technology, Wuhan, China; School of Electronic and Electrical Engineering, Wuhan Textile University, Wuhan, China; School of Electronic and Electrical Engineering, Wuhan Textile University, Wuhan, China; School of Electronic and Electrical Engineering, Wuhan Textile University, Wuhan, China; School of Electronic and Electrical Engineering, Wuhan Textile University, Wuhan, China",2024 6th World Symposium on Artificial Intelligence (WSAI),"7 Jan 2025","2024","","","1","6","The precise and punctual anticipation of AD (Alzheimer's Disease) holds great significance in augmenting the diagnostic procedure and refining treatment results. We propose a multi-scale lightweight AD prediction network with CNN (Convolutional Neural Network) and Transformer multi-branch parallelism. Based on MobileViT, the network incorporates MobileOne Block and Ghost BottleNeck lightweight network structure. The lightweight AD prediction network demonstrates a significant level of precision of about 98% in the prognostication of AD. Compared to MobileViT, the number of network parameters is reduced by about 49%, the recognition speed is improved by about 41%, the FLOPS is reduced by about 64%, and the recognition rate is improved by about 2.16%. The data prove that the global information extraction of AD is more accurate after adding the Transformer structure. This paper also compares with other methods, and the result shows that the proposed network surpassing the present state-of-the-art (SOTA) results reported in the extant literature.","","979-8-3503-7416-2","10.1109/WSAI62426.2024.10828736","","https://ieeexplore.ieee.org/stamp/stamp.jsp?arnumber=10828736","Alzheimer disease;deep learning;MobileViT;Light weight;Transformer","Accuracy;Refining;Parallel processing;Transformers;Information retrieval;Convolutional neural networks;Alzheimer's disease;Artificial intelligence","","","","15","IEEE","7 Jan 2025","","","IEEE","IEEE Conferences"
"Tensor Completion for Alzheimer's Disease Prediction From Diffusion Tensor Imaging","Y. Gou; Y. Liu; F. He; B. Hunyadi; C. Zhu","School of Communication and Information Engineering, University of Electronic Science and Technology of China, China; School of Communication and Information Engineering, University of Electronic Science and Technology of China, Chengdu, China; School of Communication and Information Engineering, University of Electronic Science and Technology of China, China; Department of Microelectronics, TU Delft, Delft, CD, The Netherlands; School of Communication and Information Engineering, University of Electronic Science and Technology of China, China",IEEE Transactions on Biomedical Engineering,"19 Jun 2024","2024","71","7","2211","2223","Objective: Alzheimer's disease (AD) is a slowly progressive neurodegenerative disorder with insidious onset. Accurate prediction of the disease progression has received increasing attention. Cognitive scores that reflect patients' cognitive status have become important criteria for predicting AD. Most existing methods consider the relationship between neuroimages and cognitive scores to improve prediction results. However, the inherent structure information in interrelated cognitive scores is rarely considered. Method: In this article, we propose a relation-aware tensor completion multitask learning method (RATC-MTL), in which the cognitive scores are represented as a third-order tensor to preserve the global structure information in clinical scores. We combine both tensor completion and linear regression into a unified framework, which allows us to capture both inter and intra modes correlations in cognitive tensor with a low-rank constraint, as well as incorporate the relationship between biological features and cognitive status by imposing a regression model on multiple cognitive scores. Result: Compared to the single-task and state-of-the-art multi-task algorithms, our proposed method obtains the best results for predicting cognitive scores in terms of four commonly used metrics. Furthermore, the overall performance of our method in classifying AD progress is also the best. Conclusion: Our results demonstrate the effectiveness of the proposed framework in fully exploring the global structure information in cognitive scores. Significance: This study introduces a novel concept of leveraging tensor completion to assist in disease diagnoses, potentially offering a solution to the issue of data scarcity encountered in prolonged monitoring scenarios.","1558-2531","","10.1109/TBME.2024.3365131","National Key R&D Program of China(grant numbers:2023YFC3806003); Medico-Engineering Cooperation Funds from University of Electronic Science and Technology of China(grant numbers:ZYGX2021YGLH215); National Natural Science Foundation of China(grant numbers:62171088,62020106011); ","https://ieeexplore.ieee.org/stamp/stamp.jsp?arnumber=10433678","Alzheimer's disease;multitask learning;regression model;tensor completion","Tensors;Correlation;Biomarkers;Diffusion tensor imaging;Indexes;Biological system modeling;Alzheimer's disease;Multitasking;Regression analysis","Alzheimer Disease;Humans;Diffusion Tensor Imaging;Algorithms;Male;Aged;Female;Brain;Image Interpretation, Computer-Assisted;Aged, 80 and over;Machine Learning","3","","63","IEEE","13 Feb 2024","","","IEEE","IEEE Journals"
"A Transfer Learning Approach for Predicting Alzheimer's Disease","S. S. Rajeswari; M. Nair","Department of Computer Science and Engineering, Amrita Vishwa Vidyapeetham, Amritapuri, India; Department of Computer Science and Applications, Amrita Vishwa Vidyapeetham, Amritapuri, India",2021 4th Biennial International Conference on Nascent Technologies in Engineering (ICNTE),"30 Jul 2021","2021","","","1","5","Alzheimer”s disease(AD) is a human brain disorder that gradually damages the memory and cognitive skills of an individual. The prediction of this condition was often laborious and time consuming. In order to reduce these constraints, different deep learning algorithms were investigated to automate the AD detection and prediction. In this study, the potency of transfer learning approach was analyzed in detail by fine tuning the deeper layers of Transfer Learning models like VGG-19, VGG-16, Resnet-50 and Xception. In prior work, VGG-16 model was experimented on the ADNI datasets to get an accuracy of 97% and a precision of 96%. From this study, it is analyzed that the overall classification accuracy and precision of VGG- 19 is exceptionally high (98%) when compared to other models. This shows that the automated method can be a true guide in Alzheimer”s detection and prediction, especially when an early stage diagnosis may help to get the benefit of treatment.","","978-1-7281-9061-7","10.1109/ICNTE51185.2021.9487746","","https://ieeexplore.ieee.org/stamp/stamp.jsp?arnumber=9487746","Transfer Learning;Alzheimer”s Disease;ADNI;Deep Learning","Deep learning;Analytical models;Automation;Transfer learning;Prediction algorithms;Alzheimer's disease;Tuning","","14","","22","IEEE","30 Jul 2021","","","IEEE","IEEE Conferences"
"A Comprehensive Fuzzy Ontology-Based Decision Support System for Alzheimer’s Disease Diagnosis","N. Shoaip; A. Rezk; S. El-Sappagh; L. Alarabi; S. Barakat; M. M. Elmogy","Department of Information Systems, Faculty of Computers and Information, Mansoura University, Mansoura, Egypt; Department of Information Systems, Faculty of Computers and Information, Mansoura University, Mansoura, Egypt; Centro Singular de Investigación en Tecnoloxías Intelixentes (CiTIUS), Universidade de Santiago de Compostela, Santiago de Compostela, Spain; Department of Computer Science, Umm Al-Qura University, Makkah, Saudi Arabia; Department of Information Systems, Faculty of Computers and Information, Mansoura University, Mansoura, Egypt; Department of Information Technology, Faculty of Computers and Information, Mansoura University, Mansoura, Egypt",IEEE Access,"26 Feb 2021","2021","9","","31350","31372","The World Health Organization (WHO) indicates that the proportion of the elderly will soon include nearly a quarter of the world population. Ensuring that health systems are prepared to deal with this phenomenal rate of aging and associated diseases generates many challenges. Among these challenges is facing Alzheimer's Disease (AD) that may occur at some point in the elderly life and may harm societies. AD is considered a neurological, psychological, mental, and health setback. The Clinical Decision Support System (CDSS) can improve patient care and support many medical functions, such as diagnosing diseases that can reduce preventable harm. This research's main objective is to design, implement, and evaluate the Alzheimer's Disease Diagnosis Ontology (ADDO). It is a comprehensive semantic knowledge base toward the development of fuzzy ontology-based CDSS for AD diagnosis. ADDO can serve as a core component of CDSS, which provides representation, annotation, and access to aspects related to AD's study and diagnosis. Toward the management of this objective, ADDO is based on the essentials of the Open Biomedical Ontology (OBO) and follows the Basic Formal Ontology (BFO) and the Ontology for General Medical Sciences (OGMS) principles. ADDO focuses on representing the patient characteristics, complications, drugs, diagnosis examination tests, and key aspects of their periodic visits in a standard way. The possibility of semantic interoperability is taken into account by integrating ADDO and a heterogeneous AD dataset. We used ADNI as a case study to mapping a set of real instances. To manage the medical domain's uncertainty, ADDO is extended to fuzzy ontology to accommodate the medical linguistic variables and enhance diagnosis results' efficiency. ADDO is constructed using Protégé 5.5.0 software and evaluated using the HermiT reasoner and SPARQL semantic queries. ADDO currently includes 7060 concepts, 99 properties, 46274 axioms, and 30708 annotations. As a result, ADDO is consistent and more reliable in managing most AD aspects than other existing AD ontologies.","2169-3536","","10.1109/ACCESS.2020.3048435","","https://ieeexplore.ieee.org/stamp/stamp.jsp?arnumber=9311736","Fuzzy ontology;clinical decision support system;Alzheimer’s disease;knowledge based;Mild COGNITIVE impairment;ontology representation","Ontologies;Diseases;Medical diagnostic imaging;Semantics;Medical services;Alzheimer's disease;Computers","","20","","56","CCBY","31 Dec 2020","","","IEEE","IEEE Journals"
"Fractal dimension for classifying 3D brain MRI using improved triangle box-counting method","Y. Kaewaramsri; S. Abu Ishaq Alfarozi; K. Woraratpanya; Y. Kuroki","Faculty of Information Technology, King Mongkut's Institute of Technology Ladkrabang, Bangkok, Thailand; Faculty of Information Technology, King Mongkut's Institute of Technology Ladkrabang, Bangkok, TH; Faculty of Information Technology, King Mongkut's Institute of Technology Ladkrabang, Bangkok, Thailand; Kurume College, National Institute of Technology, Fukuoka, Japan",2016 8th International Conference on Information Technology and Electrical Engineering (ICITEE),"28 Feb 2017","2016","","","1","6","Although many papers have used fractal dimension (FD) to analyze magnetic resonance imaging (MRI) for detecting various brain diseases, especially Alzheimer's disease (AD), they have been unsuccessful to classify the AD patients in case of healthy and AD brain-MRIs. The significant problems are from (i) the lack of the efficient FD estimation method and (ii) the failure of applying statistical analysis to discriminate the subjects in MRIs. Therefore, this paper proposes an alternative way to overcome these problems by using an improved triangle box-counting method (ITBC) for effective FD estimation and using machine learning for brain-MRI discrimination. The proposed method is evaluated its performance with the Alzheimer's disease patient discrimination dataset of open access series of imaging studies (OASIS). The experimental results show that the pro-posed method can achieve the classification accuracy rate up to 86.20% whereas the statistical analysis approaches cannot discriminate healthy and AD.","","978-1-5090-4139-8","10.1109/ICITEED.2016.7863304","","https://ieeexplore.ieee.org/stamp/stamp.jsp?arnumber=7863304","fractal dimension (FD);improved triangle box-counting (ITBC);3D brain MRI;Alzheimer's disease (AD)","Estimation;Magnetic resonance imaging;Three-dimensional displays;Diseases;Information technology;Fractals;Statistical analysis","","2","","10","IEEE","28 Feb 2017","","","IEEE","IEEE Conferences"
"Explainable Tensor Multi-Task Ensemble Learning Based on Brain Structure Variation for Alzheimer’s Disease Dynamic Prediction","Y. Zhang; T. Liu; V. Lanfranchi; P. Yang","Department of Computer Science, The University of Sheffield, Sheffield, U.K.; Department of Computer Science, The University of Sheffield, Sheffield, U.K.; Department of Computer Science, The University of Sheffield, Sheffield, U.K.; Department of Computer Science, The University of Sheffield, Sheffield, U.K.",IEEE Journal of Translational Engineering in Health and Medicine,"23 Nov 2022","2023","11","","1","12","Machine learning approaches for predicting Alzheimer’s disease (AD) progression can substantially assist researchers and clinicians in developing effective AD preventive and treatment strategies. This study proposes a novel machine learning algorithm to predict the AD progression utilising a multi-task ensemble learning approach. Specifically, we present a novel tensor multi-task learning (MTL) algorithm based on similarity measurement of spatio-temporal variability of brain biomarkers to model AD progression. In this model, the prediction of each patient sample in the tensor is set as one task, where all tasks share a set of latent factors obtained through tensor decomposition. Furthermore, as subjects have continuous records of brain biomarker testing, the model is extended to ensemble the subjects’ temporally continuous prediction results utilising a gradient boosting kernel to find more accurate predictions. We have conducted extensive experiments utilising data from the Alzheimer’s Disease Neuroimaging Initiative (ADNI) to evaluate the performance of the proposed algorithm and model. Results demonstrate that the proposed model have superior accuracy and stability in predicting AD progression compared to benchmarks and state-of-the-art multi-task regression methods in terms of the Mini Mental State Examination (MMSE) questionnaire and The Alzheimer’s Disease Assessment Scale-Cognitive Subscale (ADAS-Cog) cognitive scores. Brain biomarker correlation information can be utilised to identify variations in individual brain structures and the model can be utilised to effectively predict the progression of AD with magnetic resonance imaging (MRI) data and cognitive scores of AD patients at different stages.","2168-2372","","10.1109/JTEHM.2022.3219775","Innovate UK(grant numbers:107462,10002902); EPSRC Industrial Cooperative Awards in Science and Technology(grant numbers:165332); ","https://ieeexplore.ieee.org/stamp/stamp.jsp?arnumber=9940175","Alzheimer’s disease;multi-task learning;brain biomarker spatio-temporal correlation;tensor decomposition;gradient boosting ensemble learning","Biomarkers;Tensors;Magnetic resonance imaging;Biological system modeling;Correlation;Brain modeling;Predictive models","Humans;Alzheimer Disease;Brain;Machine Learning","11","","47","CCBY","4 Nov 2022","","","IEEE","IEEE Journals"
"Computerized classification of patients with alzheimer's disease based on arterial spin-labeled perfusion MRI","Y. Yamashita; H. Arimura; T. Yoshiura; C. Tokunaga; T. Magome; A. Monji; Y. Nakamura; N. Ohya; H. Honda; Y. Higashida; Masafumi Ohki; Fukai Toyofuku","Graduate School of Medical Science, Kyushu University, Japan; Faculty of Medical Science, Kyushu University, Japan; Department of Clinical Radiology, Graduate School of Medical Sciences, Kyushu University, Japan; Graduate School of Medical Science, Kyushu University, Japan; Graduate School of Medical Science, Kyushu University, Japan; Department of Neuropsychiatry, Graduate School of Medical Sciences, Kyushu University, Japan; Division of Radiology, Department of Medical Technology, Kyushu University Hospital, Japan; Division of Radiology, Department of Medical Technology, Kyushu University Hospital, Japan; Department of Clinical Radiology, Graduate School of Medical Sciences, Kyushu University, Japan; Faculty of Medical Science, Kyushu University, Japan; Faculty of Medical Science, Kyushu University, Japan; Faculty of Medical Science, Kyushu University, Japan",2010 World Automation Congress,"10 Dec 2010","2010","","","1","4","Most computer-aided diagnosis systems for Alzheimer's disease (AD) using magnetic resonance (MR) imaging were based on morphological image features, not functional image features, which would be also useful for diagnosis of AD. The aim of this study was to develop a computer-aided classification system for AD patients based on functional image features derived from the cerebral blood flow (CBF) maps measured by arterial spin labeling (ASL) technique which is one of MR imaging techniques. In the first step, the average CBFs in ten cortical regions were determined as functional image features based on the CBF map image, which was non-linearly registered to a Talairach brain atlas. In the next step, a support vector machine was trained by the average CBFs in ten cortical functional regions, and was employed for distinguishing patients with AD from control subjects. For evaluation of the method, we applied the proposed method to 20 cases including ten AD patients and ten control subjects, who were scanned at a 3.0-Tesla MR unit. As a result, the area under the receiver operating characteristic curve was 0.893 based on a leave-one-out-by-case test. The proposed method would be feasible for classification of patients with AD.","2154-4824","978-1-889335-42-1","","","https://ieeexplore.ieee.org/stamp/stamp.jsp?arnumber=5665591","Arterial spin labeling (ASL);Alzheimer's disease (AD);magnetic resonance imaging (MRI);computer-aided classification","Magnetic resonance imaging;Alzheimer's disease","","","","13","","10 Dec 2010","","","IEEE","IEEE Conferences"
"An Intelligent Framework for Alzheimer's disease Classification Using EfficientNet Transfer Learning Model","M. Sethi; S. Ahuja; S. Singh; J. Snehi; M. Chawla","Chitkara University Institute of Engineering & Technology, Chitkara University, Punjab, India; Chitkara University Institute of Engineering & Technology, Chitkara University, Punjab, India; Chitkara University Institute of Engineering & Technology, Chitkara University, Punjab, India; Chitkara University Institute of Engineering & Technology, Chitkara University, Punjab, India; Panipat Institute of Engineering & Technology, Panipat",2022 International Conference on Emerging Smart Computing and Informatics (ESCI),"22 Apr 2022","2022","","","1","4","Alzheimer's disease (AD) is a prevalent psychological disorder. The economic cost of treating for AD patients is expected to increase. Therefore in the last few years, research on AD diagnostic has laid great emphasis on computer-aided methods. The significance of developing an artificial intelligent diagnostic technique towards accurate and early AD classification seems essential. Deep-learning models hold significant benefits over machine learning approaches as these techniques do not require any kind of feature engineering. Moreover, T1-weighted Magnetic Resonance Imaging (MRI) is the neuroimaging data modality which is widely practiced for such a purpose. In some cases, the most significant barrier to integrating DL models into pre-existing applications is a lack of adequate data architecture. Changing medical information is usually hard to communicate, examine, and interpret. Transfer learning (TL) allows designers to use a combination of models in order to fine-tune a specified solution to a target problem. Transferring knowledge across two separate models could lead a generally a more reliable and precise model. In this work, researchers utilized an EfficientNet TL model already trained on ImageNet dataset to categorise subjects as AD vs. Cognitive Normal (CN) based on MRI scans of the brain. The dataset for this study was acquired from Alzheimer Disease Neuroimaging Initiative (ADNI). The performance parameters such as accuracy, AUC were used to evaluate the model. The proposed model on ADNI dataset achieved an accuracy level of 91.36% and AUC as 83% in comparison to other existing transfer learning models.","","978-1-6654-0073-2","10.1109/ESCI53509.2022.9758195","","https://ieeexplore.ieee.org/stamp/stamp.jsp?arnumber=9758195","Alzheimer's disease;Magnetic Resonance Imaging;Classification;Transfer Learning;EfficientNet","Neuroimaging;Biological system modeling;Magnetic resonance imaging;Computational modeling;Transfer learning;Brain modeling;Reliability","","12","","12","IEEE","22 Apr 2022","","","IEEE","IEEE Conferences"
