pmid,pmcid,title,journal,year,volume,issue,pages,doi,authors,first_author,last_author,epubdate,pubdate,mesh,affiliations,url,query
36120780,,Digital Technologies to Prevent Social Isolation and Loneliness in Dementia: A Systematic Review.,J Alzheimers Dis,2022,90,2,513-528,10.3233/JAD-220438,,,,,2022-01-01T00:00:00,,,https://ncbi.nlm.nih.gov/pubmed/36120780,"(""Alzheimer Disease""[MeSH Terms] OR alzheimer*[Title/Abstract] OR dementia[Title/Abstract]) AND (technology OR technologies OR wearable* OR sensor* OR ""assistive technolog*"" OR ""smart home"" OR ""digital biomarker*"" OR ""Internet of Things"" OR IoT OR ""machine learning"" OR ""artificial intelligence"" OR AI OR eye-tracking OR ""speech analysis"") AND (2014:2025[dp]) AND humans[MeSH Terms]"
37250469,,Therapeutic Potential of Nanomedicine in Management of Alzheimer's Disease and Glioma.,Int J Nanomedicine,2023,18,,2737-2756,10.2147/IJN.S405454,,,,,2023-01-01T00:00:00,,,https://ncbi.nlm.nih.gov/pubmed/37250469,"(""Alzheimer Disease""[MeSH Terms] OR alzheimer*[Title/Abstract] OR dementia[Title/Abstract]) AND (technology OR technologies OR wearable* OR sensor* OR ""assistive technolog*"" OR ""smart home"" OR ""digital biomarker*"" OR ""Internet of Things"" OR IoT OR ""machine learning"" OR ""artificial intelligence"" OR AI OR eye-tracking OR ""speech analysis"") AND (2014:2025[dp]) AND humans[MeSH Terms]"
34750588,,Dissecting the complexities of Alzheimer disease with in vitro models of the human brain.,Nat Rev Neurol,2022,18,1,25-39,10.1038/s41582-021-00578-6,,,,,2022-01-01T00:00:00,,,https://ncbi.nlm.nih.gov/pubmed/34750588,"(""Alzheimer Disease""[MeSH Terms] OR alzheimer*[Title/Abstract] OR dementia[Title/Abstract]) AND (technology OR technologies OR wearable* OR sensor* OR ""assistive technolog*"" OR ""smart home"" OR ""digital biomarker*"" OR ""Internet of Things"" OR IoT OR ""machine learning"" OR ""artificial intelligence"" OR AI OR eye-tracking OR ""speech analysis"") AND (2014:2025[dp]) AND humans[MeSH Terms]"
35257810,,Versatile nanomaterials for Alzheimer's disease: Pathogenesis inspired disease-modifying therapy.,J Control Release,2022,345,,38-61,10.1016/j.jconrel.2022.02.034,,,,,2022-05-01T00:00:00,,,https://ncbi.nlm.nih.gov/pubmed/35257810,"(""Alzheimer Disease""[MeSH Terms] OR alzheimer*[Title/Abstract] OR dementia[Title/Abstract]) AND (technology OR technologies OR wearable* OR sensor* OR ""assistive technolog*"" OR ""smart home"" OR ""digital biomarker*"" OR ""Internet of Things"" OR IoT OR ""machine learning"" OR ""artificial intelligence"" OR AI OR eye-tracking OR ""speech analysis"") AND (2014:2025[dp]) AND humans[MeSH Terms]"
29678927,,Digital technologies for the assessment of cognition: a clinical review.,Evid Based Ment Health,2018,21,2,67-71,10.1136/eb-2018-102890,,,,,2018-05-01T00:00:00,,,https://ncbi.nlm.nih.gov/pubmed/29678927,"(""Alzheimer Disease""[MeSH Terms] OR alzheimer*[Title/Abstract] OR dementia[Title/Abstract]) AND (technology OR technologies OR wearable* OR sensor* OR ""assistive technolog*"" OR ""smart home"" OR ""digital biomarker*"" OR ""Internet of Things"" OR IoT OR ""machine learning"" OR ""artificial intelligence"" OR AI OR eye-tracking OR ""speech analysis"") AND (2014:2025[dp]) AND humans[MeSH Terms]"
34300547,,Review of Technology-Supported Multimodal Solutions for People with Dementia.,Sensors (Basel),2021,21,14,,10.3390/s21144806,,,,,2021-07-14T00:00:00,,,https://ncbi.nlm.nih.gov/pubmed/34300547,"(""Alzheimer Disease""[MeSH Terms] OR alzheimer*[Title/Abstract] OR dementia[Title/Abstract]) AND (technology OR technologies OR wearable* OR sensor* OR ""assistive technolog*"" OR ""smart home"" OR ""digital biomarker*"" OR ""Internet of Things"" OR IoT OR ""machine learning"" OR ""artificial intelligence"" OR AI OR eye-tracking OR ""speech analysis"") AND (2014:2025[dp]) AND humans[MeSH Terms]"
28940133,,Ethical Design of Intelligent Assistive Technologies for Dementia: A Descriptive Review.,Sci Eng Ethics,2018,24,4,1035-1055,10.1007/s11948-017-9976-1,,,,,2018-08-01T00:00:00,,,https://ncbi.nlm.nih.gov/pubmed/28940133,"(""Alzheimer Disease""[MeSH Terms] OR alzheimer*[Title/Abstract] OR dementia[Title/Abstract]) AND (technology OR technologies OR wearable* OR sensor* OR ""assistive technolog*"" OR ""smart home"" OR ""digital biomarker*"" OR ""Internet of Things"" OR IoT OR ""machine learning"" OR ""artificial intelligence"" OR AI OR eye-tracking OR ""speech analysis"") AND (2014:2025[dp]) AND humans[MeSH Terms]"
31906949,,Clinical trials of new drugs for Alzheimer disease.,J Biomed Sci,2020,27,1,18,10.1186/s12929-019-0609-7,,,,,2020-01-06T00:00:00,,,https://ncbi.nlm.nih.gov/pubmed/31906949,"(""Alzheimer Disease""[MeSH Terms] OR alzheimer*[Title/Abstract] OR dementia[Title/Abstract]) AND (technology OR technologies OR wearable* OR sensor* OR ""assistive technolog*"" OR ""smart home"" OR ""digital biomarker*"" OR ""Internet of Things"" OR IoT OR ""machine learning"" OR ""artificial intelligence"" OR AI OR eye-tracking OR ""speech analysis"") AND (2014:2025[dp]) AND humans[MeSH Terms]"
31189781,,Plant-based vaccines for Alzheimer's disease.,Proc Jpn Acad Ser B Phys Biol Sci,2019,95,6,290-294,10.2183/pjab.95.020,,,,,2019-01-01T00:00:00,,,https://ncbi.nlm.nih.gov/pubmed/31189781,"(""Alzheimer Disease""[MeSH Terms] OR alzheimer*[Title/Abstract] OR dementia[Title/Abstract]) AND (technology OR technologies OR wearable* OR sensor* OR ""assistive technolog*"" OR ""smart home"" OR ""digital biomarker*"" OR ""Internet of Things"" OR IoT OR ""machine learning"" OR ""artificial intelligence"" OR AI OR eye-tracking OR ""speech analysis"") AND (2014:2025[dp]) AND humans[MeSH Terms]"
34275100,,Role of TREM2 in Alzheimer's Disease: A Long Road Ahead.,Mol Neurobiol,2021,58,10,5239-5252,10.1007/s12035-021-02477-9,,,,,2021-10-01T00:00:00,,,https://ncbi.nlm.nih.gov/pubmed/34275100,"(""Alzheimer Disease""[MeSH Terms] OR alzheimer*[Title/Abstract] OR dementia[Title/Abstract]) AND (technology OR technologies OR wearable* OR sensor* OR ""assistive technolog*"" OR ""smart home"" OR ""digital biomarker*"" OR ""Internet of Things"" OR IoT OR ""machine learning"" OR ""artificial intelligence"" OR AI OR eye-tracking OR ""speech analysis"") AND (2014:2025[dp]) AND humans[MeSH Terms]"
35475733,,6G and Artificial Intelligence Technologies for Dementia Care: Literature Review and Practical Analysis.,J Med Internet Res,2022,24,4,e30503,10.2196/30503,,,,,2022-04-27T00:00:00,,,https://ncbi.nlm.nih.gov/pubmed/35475733,"(""Alzheimer Disease""[MeSH Terms] OR alzheimer*[Title/Abstract] OR dementia[Title/Abstract]) AND (technology OR technologies OR wearable* OR sensor* OR ""assistive technolog*"" OR ""smart home"" OR ""digital biomarker*"" OR ""Internet of Things"" OR IoT OR ""machine learning"" OR ""artificial intelligence"" OR AI OR eye-tracking OR ""speech analysis"") AND (2014:2025[dp]) AND humans[MeSH Terms]"
38475108,,Machine Learning and Digital Biomarkers Can Detect Early Stages of Neurodegenerative Diseases.,Sensors (Basel),2024,24,5,,10.3390/s24051572,,,,,2024-02-29T00:00:00,,,https://ncbi.nlm.nih.gov/pubmed/38475108,"(""Alzheimer Disease""[MeSH Terms] OR alzheimer*[Title/Abstract] OR dementia[Title/Abstract]) AND (technology OR technologies OR wearable* OR sensor* OR ""assistive technolog*"" OR ""smart home"" OR ""digital biomarker*"" OR ""Internet of Things"" OR IoT OR ""machine learning"" OR ""artificial intelligence"" OR AI OR eye-tracking OR ""speech analysis"") AND (2014:2025[dp]) AND humans[MeSH Terms]"
37520470,,Eyes on dementia: an overview of the interplay between eye movements and cognitive decline.,J Med Life,2023,16,5,642-662,10.25122/jml-2023-0217,,,,,2023-05-01T00:00:00,,,https://ncbi.nlm.nih.gov/pubmed/37520470,"(""Alzheimer Disease""[MeSH Terms] OR alzheimer*[Title/Abstract] OR dementia[Title/Abstract]) AND (technology OR technologies OR wearable* OR sensor* OR ""assistive technolog*"" OR ""smart home"" OR ""digital biomarker*"" OR ""Internet of Things"" OR IoT OR ""machine learning"" OR ""artificial intelligence"" OR AI OR eye-tracking OR ""speech analysis"") AND (2014:2025[dp]) AND humans[MeSH Terms]"
31451912,,Artificial intelligence as an emerging technology in the current care of neurological disorders.,J Neurol,2021,268,5,1623-1642,10.1007/s00415-019-09518-3,,,,,2021-05-01T00:00:00,,,https://ncbi.nlm.nih.gov/pubmed/31451912,"(""Alzheimer Disease""[MeSH Terms] OR alzheimer*[Title/Abstract] OR dementia[Title/Abstract]) AND (technology OR technologies OR wearable* OR sensor* OR ""assistive technolog*"" OR ""smart home"" OR ""digital biomarker*"" OR ""Internet of Things"" OR IoT OR ""machine learning"" OR ""artificial intelligence"" OR AI OR eye-tracking OR ""speech analysis"") AND (2014:2025[dp]) AND humans[MeSH Terms]"
37414222,,Emerging nanotechnology for Alzheimer's disease: From detection to treatment.,J Control Release,2023,360,,392-417,10.1016/j.jconrel.2023.07.004,,,,,2023-08-01T00:00:00,,,https://ncbi.nlm.nih.gov/pubmed/37414222,"(""Alzheimer Disease""[MeSH Terms] OR alzheimer*[Title/Abstract] OR dementia[Title/Abstract]) AND (technology OR technologies OR wearable* OR sensor* OR ""assistive technolog*"" OR ""smart home"" OR ""digital biomarker*"" OR ""Internet of Things"" OR IoT OR ""machine learning"" OR ""artificial intelligence"" OR AI OR eye-tracking OR ""speech analysis"") AND (2014:2025[dp]) AND humans[MeSH Terms]"
33463089,,Functional nanoassemblies for the diagnosis and therapy of Alzheimer's diseases.,Wiley Interdiscip Rev Nanomed Nanobiotechnol,2021,13,4,e1696,10.1002/wnan.1696,,,,,2021-07-01T00:00:00,,,https://ncbi.nlm.nih.gov/pubmed/33463089,"(""Alzheimer Disease""[MeSH Terms] OR alzheimer*[Title/Abstract] OR dementia[Title/Abstract]) AND (technology OR technologies OR wearable* OR sensor* OR ""assistive technolog*"" OR ""smart home"" OR ""digital biomarker*"" OR ""Internet of Things"" OR IoT OR ""machine learning"" OR ""artificial intelligence"" OR AI OR eye-tracking OR ""speech analysis"") AND (2014:2025[dp]) AND humans[MeSH Terms]"
37762346,,Advancements in the Application of Nanomedicine in Alzheimer's Disease: A Therapeutic Perspective.,Int J Mol Sci,2023,24,18,,10.3390/ijms241814044,,,,,2023-09-13T00:00:00,,,https://ncbi.nlm.nih.gov/pubmed/37762346,"(""Alzheimer Disease""[MeSH Terms] OR alzheimer*[Title/Abstract] OR dementia[Title/Abstract]) AND (technology OR technologies OR wearable* OR sensor* OR ""assistive technolog*"" OR ""smart home"" OR ""digital biomarker*"" OR ""Internet of Things"" OR IoT OR ""machine learning"" OR ""artificial intelligence"" OR AI OR eye-tracking OR ""speech analysis"") AND (2014:2025[dp]) AND humans[MeSH Terms]"
30323557,,Copper-64: a real theranostic agent.,Drug Des Devel Ther,2018,12,,3235-3245,10.2147/DDDT.S170879,,,,,2018-01-01T00:00:00,,,https://ncbi.nlm.nih.gov/pubmed/30323557,"(""Alzheimer Disease""[MeSH Terms] OR alzheimer*[Title/Abstract] OR dementia[Title/Abstract]) AND (technology OR technologies OR wearable* OR sensor* OR ""assistive technolog*"" OR ""smart home"" OR ""digital biomarker*"" OR ""Internet of Things"" OR IoT OR ""machine learning"" OR ""artificial intelligence"" OR AI OR eye-tracking OR ""speech analysis"") AND (2014:2025[dp]) AND humans[MeSH Terms]"
37972072,,Explainable AI-based Alzheimer's prediction and management using multimodal data.,PLoS One,2023,18,11,e0294253,10.1371/journal.pone.0294253,,,,,2023-01-01T00:00:00,,,https://ncbi.nlm.nih.gov/pubmed/37972072,"(""Alzheimer Disease""[MeSH Terms] OR alzheimer*[Title/Abstract] OR dementia[Title/Abstract]) AND (technology OR technologies OR wearable* OR sensor* OR ""assistive technolog*"" OR ""smart home"" OR ""digital biomarker*"" OR ""Internet of Things"" OR IoT OR ""machine learning"" OR ""artificial intelligence"" OR AI OR eye-tracking OR ""speech analysis"") AND (2014:2025[dp]) AND humans[MeSH Terms]"
32473177,,Neurotherapeutic applications of nanomedicine for treating Alzheimer's disease.,J Control Release,2020,325,,25-37,10.1016/j.jconrel.2020.05.044,,,,,2020-09-10T00:00:00,,,https://ncbi.nlm.nih.gov/pubmed/32473177,"(""Alzheimer Disease""[MeSH Terms] OR alzheimer*[Title/Abstract] OR dementia[Title/Abstract]) AND (technology OR technologies OR wearable* OR sensor* OR ""assistive technolog*"" OR ""smart home"" OR ""digital biomarker*"" OR ""Internet of Things"" OR IoT OR ""machine learning"" OR ""artificial intelligence"" OR AI OR eye-tracking OR ""speech analysis"") AND (2014:2025[dp]) AND humans[MeSH Terms]"
28666544,,Advances in Alzheimer's Diagnosis and Therapy: The Implications of Nanotechnology.,Trends Biotechnol,2017,35,10,937-953,10.1016/j.tibtech.2017.06.002,,,,,2017-10-01T00:00:00,,,https://ncbi.nlm.nih.gov/pubmed/28666544,"(""Alzheimer Disease""[MeSH Terms] OR alzheimer*[Title/Abstract] OR dementia[Title/Abstract]) AND (technology OR technologies OR wearable* OR sensor* OR ""assistive technolog*"" OR ""smart home"" OR ""digital biomarker*"" OR ""Internet of Things"" OR IoT OR ""machine learning"" OR ""artificial intelligence"" OR AI OR eye-tracking OR ""speech analysis"") AND (2014:2025[dp]) AND humans[MeSH Terms]"
25039777,,Nanotechnology and Alzheimer's disease: what has been done and what to do.,Curr Med Chem,2014,21,36,4169-85,10.2174/0929867321666140716100056,,,,,2014-01-01T00:00:00,,,https://ncbi.nlm.nih.gov/pubmed/25039777,"(""Alzheimer Disease""[MeSH Terms] OR alzheimer*[Title/Abstract] OR dementia[Title/Abstract]) AND (technology OR technologies OR wearable* OR sensor* OR ""assistive technolog*"" OR ""smart home"" OR ""digital biomarker*"" OR ""Internet of Things"" OR IoT OR ""machine learning"" OR ""artificial intelligence"" OR AI OR eye-tracking OR ""speech analysis"") AND (2014:2025[dp]) AND humans[MeSH Terms]"
39625718,,Recent Progress in Nanomedicine for the Diagnosis and Treatment of Alzheimer's Diseases.,ACS Nano,2024,18,50,33792-33826,10.1021/acsnano.4c11966,,,,,2024-12-17T00:00:00,,,https://ncbi.nlm.nih.gov/pubmed/39625718,"(""Alzheimer Disease""[MeSH Terms] OR alzheimer*[Title/Abstract] OR dementia[Title/Abstract]) AND (technology OR technologies OR wearable* OR sensor* OR ""assistive technolog*"" OR ""smart home"" OR ""digital biomarker*"" OR ""Internet of Things"" OR IoT OR ""machine learning"" OR ""artificial intelligence"" OR AI OR eye-tracking OR ""speech analysis"") AND (2014:2025[dp]) AND humans[MeSH Terms]"
33078687,,Dementia 360 ECHO: Using technology to facilitate diagnosis and treatment.,Gerontol Geriatr Educ,2022,43,2,202-208,10.1080/02701960.2020.1835658,,,,,2022-01-01T00:00:00,,,https://ncbi.nlm.nih.gov/pubmed/33078687,"(""Alzheimer Disease""[MeSH Terms] OR alzheimer*[Title/Abstract] OR dementia[Title/Abstract]) AND (technology OR technologies OR wearable* OR sensor* OR ""assistive technolog*"" OR ""smart home"" OR ""digital biomarker*"" OR ""Internet of Things"" OR IoT OR ""machine learning"" OR ""artificial intelligence"" OR AI OR eye-tracking OR ""speech analysis"") AND (2014:2025[dp]) AND humans[MeSH Terms]"
37737824,,Chemical Synthesis of Microtubule-Associated Protein Tau.,J Am Chem Soc,2023,145,39,21514-21526,10.1021/jacs.3c07338,,,,,2023-10-04T00:00:00,,,https://ncbi.nlm.nih.gov/pubmed/37737824,"(""Alzheimer Disease""[MeSH Terms] OR alzheimer*[Title/Abstract] OR dementia[Title/Abstract]) AND (technology OR technologies OR wearable* OR sensor* OR ""assistive technolog*"" OR ""smart home"" OR ""digital biomarker*"" OR ""Internet of Things"" OR IoT OR ""machine learning"" OR ""artificial intelligence"" OR AI OR eye-tracking OR ""speech analysis"") AND (2014:2025[dp]) AND humans[MeSH Terms]"
34781953,,Design of a seniors and Alzheimer's disease caring service platform.,BMC Med Inform Decis Mak,2021,21,Suppl 10,273,10.1186/s12911-021-01626-3,,,,,2021-11-16T00:00:00,,,https://ncbi.nlm.nih.gov/pubmed/34781953,"(""Alzheimer Disease""[MeSH Terms] OR alzheimer*[Title/Abstract] OR dementia[Title/Abstract]) AND (technology OR technologies OR wearable* OR sensor* OR ""assistive technolog*"" OR ""smart home"" OR ""digital biomarker*"" OR ""Internet of Things"" OR IoT OR ""machine learning"" OR ""artificial intelligence"" OR AI OR eye-tracking OR ""speech analysis"") AND (2014:2025[dp]) AND humans[MeSH Terms]"
40935375,,[Digital Technologies for Enhancing Dementia Screening].,Brain Nerve,2025,77,9,981-985,10.11477/mf.188160960770090981,,,,,2025-09-01T00:00:00,,,https://ncbi.nlm.nih.gov/pubmed/40935375,"(""Alzheimer Disease""[MeSH Terms] OR alzheimer*[Title/Abstract] OR dementia[Title/Abstract]) AND (technology OR technologies OR wearable* OR sensor* OR ""assistive technolog*"" OR ""smart home"" OR ""digital biomarker*"" OR ""Internet of Things"" OR IoT OR ""machine learning"" OR ""artificial intelligence"" OR AI OR eye-tracking OR ""speech analysis"") AND (2014:2025[dp]) AND humans[MeSH Terms]"
38067098,,The Major Hypotheses of Alzheimer's Disease: Related Nanotechnology-Based Approaches for Its Diagnosis and Treatment.,Cells,2023,12,23,,10.3390/cells12232669,,,,,2023-11-21T00:00:00,,,https://ncbi.nlm.nih.gov/pubmed/38067098,"(""Alzheimer Disease""[MeSH Terms] OR alzheimer*[Title/Abstract] OR dementia[Title/Abstract]) AND (technology OR technologies OR wearable* OR sensor* OR ""assistive technolog*"" OR ""smart home"" OR ""digital biomarker*"" OR ""Internet of Things"" OR IoT OR ""machine learning"" OR ""artificial intelligence"" OR AI OR eye-tracking OR ""speech analysis"") AND (2014:2025[dp]) AND humans[MeSH Terms]"
33892789,,Remote monitoring technologies in Alzheimer's disease: design of the RADAR-AD study.,Alzheimers Res Ther,2021,13,1,89,10.1186/s13195-021-00825-4,,,,,2021-04-23T00:00:00,,,https://ncbi.nlm.nih.gov/pubmed/33892789,"(""Alzheimer Disease""[MeSH Terms] OR alzheimer*[Title/Abstract] OR dementia[Title/Abstract]) AND (technology OR technologies OR wearable* OR sensor* OR ""assistive technolog*"" OR ""smart home"" OR ""digital biomarker*"" OR ""Internet of Things"" OR IoT OR ""machine learning"" OR ""artificial intelligence"" OR AI OR eye-tracking OR ""speech analysis"") AND (2014:2025[dp]) AND humans[MeSH Terms]"
38191034,,Nanotechnology in the diagnostic and therapy for Alzheimer's disease.,Biochim Biophys Acta Gen Subj,2024,1868,3,130559,10.1016/j.bbagen.2024.130559,,,,,2024-03-01T00:00:00,,,https://ncbi.nlm.nih.gov/pubmed/38191034,"(""Alzheimer Disease""[MeSH Terms] OR alzheimer*[Title/Abstract] OR dementia[Title/Abstract]) AND (technology OR technologies OR wearable* OR sensor* OR ""assistive technolog*"" OR ""smart home"" OR ""digital biomarker*"" OR ""Internet of Things"" OR IoT OR ""machine learning"" OR ""artificial intelligence"" OR AI OR eye-tracking OR ""speech analysis"") AND (2014:2025[dp]) AND humans[MeSH Terms]"
30826404,,Nanoparticle formulations in the diagnosis and therapy of Alzheimer's disease.,Int J Biol Macromol,2019,130,,515-526,10.1016/j.ijbiomac.2019.02.156,,,,,2019-06-01T00:00:00,,,https://ncbi.nlm.nih.gov/pubmed/30826404,"(""Alzheimer Disease""[MeSH Terms] OR alzheimer*[Title/Abstract] OR dementia[Title/Abstract]) AND (technology OR technologies OR wearable* OR sensor* OR ""assistive technolog*"" OR ""smart home"" OR ""digital biomarker*"" OR ""Internet of Things"" OR IoT OR ""machine learning"" OR ""artificial intelligence"" OR AI OR eye-tracking OR ""speech analysis"") AND (2014:2025[dp]) AND humans[MeSH Terms]"
34285915,,The Potential Benefits of Nanotechnology in Treating Alzheimer's Disease.,Biomed Res Int,2021,2021,,5550938,10.1155/2021/5550938,,,,,2021-01-01T00:00:00,,,https://ncbi.nlm.nih.gov/pubmed/34285915,"(""Alzheimer Disease""[MeSH Terms] OR alzheimer*[Title/Abstract] OR dementia[Title/Abstract]) AND (technology OR technologies OR wearable* OR sensor* OR ""assistive technolog*"" OR ""smart home"" OR ""digital biomarker*"" OR ""Internet of Things"" OR IoT OR ""machine learning"" OR ""artificial intelligence"" OR AI OR eye-tracking OR ""speech analysis"") AND (2014:2025[dp]) AND humans[MeSH Terms]"
39928936,,Use of Digital Health Technologies for Dementia Care: Bibliometric Analysis and Report.,JMIR Ment Health,2025,12,,e64445,10.2196/64445,,,,,2025-02-10T00:00:00,,,https://ncbi.nlm.nih.gov/pubmed/39928936,"(""Alzheimer Disease""[MeSH Terms] OR alzheimer*[Title/Abstract] OR dementia[Title/Abstract]) AND (technology OR technologies OR wearable* OR sensor* OR ""assistive technolog*"" OR ""smart home"" OR ""digital biomarker*"" OR ""Internet of Things"" OR IoT OR ""machine learning"" OR ""artificial intelligence"" OR AI OR eye-tracking OR ""speech analysis"") AND (2014:2025[dp]) AND humans[MeSH Terms]"
38324244,,Artificial Intelligence and Technology Collaboratories: Innovating aging research and Alzheimer's care.,Alzheimers Dement,2024,20,4,3074-3079,10.1002/alz.13710,,,,,2024-04-01T00:00:00,,,https://ncbi.nlm.nih.gov/pubmed/38324244,"(""Alzheimer Disease""[MeSH Terms] OR alzheimer*[Title/Abstract] OR dementia[Title/Abstract]) AND (technology OR technologies OR wearable* OR sensor* OR ""assistive technolog*"" OR ""smart home"" OR ""digital biomarker*"" OR ""Internet of Things"" OR IoT OR ""machine learning"" OR ""artificial intelligence"" OR AI OR eye-tracking OR ""speech analysis"") AND (2014:2025[dp]) AND humans[MeSH Terms]"
36191675,,Neuroprotective effect of phytoconstituents via nanotechnology for treatment of Alzheimer diseases.,J Control Release,2022,351,,638-655,10.1016/j.jconrel.2022.09.058,,,,,2022-11-01T00:00:00,,,https://ncbi.nlm.nih.gov/pubmed/36191675,"(""Alzheimer Disease""[MeSH Terms] OR alzheimer*[Title/Abstract] OR dementia[Title/Abstract]) AND (technology OR technologies OR wearable* OR sensor* OR ""assistive technolog*"" OR ""smart home"" OR ""digital biomarker*"" OR ""Internet of Things"" OR IoT OR ""machine learning"" OR ""artificial intelligence"" OR AI OR eye-tracking OR ""speech analysis"") AND (2014:2025[dp]) AND humans[MeSH Terms]"
39988783,,Internet of Medical Things (IoMT) for Alzheimer Patient's Outcome.,CNS Neurol Disord Drug Targets,2025,24,7,491-493,10.2174/0118715273371149250218081425,,,,,2025-01-01T00:00:00,,,https://ncbi.nlm.nih.gov/pubmed/39988783,"(""Alzheimer Disease""[MeSH Terms] OR alzheimer*[Title/Abstract] OR dementia[Title/Abstract]) AND (technology OR technologies OR wearable* OR sensor* OR ""assistive technolog*"" OR ""smart home"" OR ""digital biomarker*"" OR ""Internet of Things"" OR IoT OR ""machine learning"" OR ""artificial intelligence"" OR AI OR eye-tracking OR ""speech analysis"") AND (2014:2025[dp]) AND humans[MeSH Terms]"
25877087,,Biomedical applications of gold nanoparticles.,Curr Top Med Chem,2015,15,16,1605-13,10.2174/1568026615666150414144750,,,,,2015-01-01T00:00:00,,,https://ncbi.nlm.nih.gov/pubmed/25877087,"(""Alzheimer Disease""[MeSH Terms] OR alzheimer*[Title/Abstract] OR dementia[Title/Abstract]) AND (technology OR technologies OR wearable* OR sensor* OR ""assistive technolog*"" OR ""smart home"" OR ""digital biomarker*"" OR ""Internet of Things"" OR IoT OR ""machine learning"" OR ""artificial intelligence"" OR AI OR eye-tracking OR ""speech analysis"") AND (2014:2025[dp]) AND humans[MeSH Terms]"
35105196,,Ethical considerations in design and implementation of home-based smart care for dementia.,Nurs Ethics,2022,29,4,1035-1046,10.1177/09697330211062980,,,,,2022-06-01T00:00:00,,,https://ncbi.nlm.nih.gov/pubmed/35105196,"(""Alzheimer Disease""[MeSH Terms] OR alzheimer*[Title/Abstract] OR dementia[Title/Abstract]) AND (technology OR technologies OR wearable* OR sensor* OR ""assistive technolog*"" OR ""smart home"" OR ""digital biomarker*"" OR ""Internet of Things"" OR IoT OR ""machine learning"" OR ""artificial intelligence"" OR AI OR eye-tracking OR ""speech analysis"") AND (2014:2025[dp]) AND humans[MeSH Terms]"
37138478,,Emerging Nanotechnology for the Treatment of Alzheimer's Disease.,CNS Neurol Disord Drug Targets,2024,23,6,687-696,10.2174/1871527322666230501232815,,,,,2024-01-01T00:00:00,,,https://ncbi.nlm.nih.gov/pubmed/37138478,"(""Alzheimer Disease""[MeSH Terms] OR alzheimer*[Title/Abstract] OR dementia[Title/Abstract]) AND (technology OR technologies OR wearable* OR sensor* OR ""assistive technolog*"" OR ""smart home"" OR ""digital biomarker*"" OR ""Internet of Things"" OR IoT OR ""machine learning"" OR ""artificial intelligence"" OR AI OR eye-tracking OR ""speech analysis"") AND (2014:2025[dp]) AND humans[MeSH Terms]"
26938815,,Treatment of Cognitive Deficits in Alzheimer's disease: A psychopharmacological review.,Psychiatr Danub,2016,28,1,2-12,,,,,,2016-03-01T00:00:00,,,https://ncbi.nlm.nih.gov/pubmed/26938815,"(""Alzheimer Disease""[MeSH Terms] OR alzheimer*[Title/Abstract] OR dementia[Title/Abstract]) AND (technology OR technologies OR wearable* OR sensor* OR ""assistive technolog*"" OR ""smart home"" OR ""digital biomarker*"" OR ""Internet of Things"" OR IoT OR ""machine learning"" OR ""artificial intelligence"" OR AI OR eye-tracking OR ""speech analysis"") AND (2014:2025[dp]) AND humans[MeSH Terms]"
28043897,,Natural products against Alzheimer's disease: Pharmaco-therapeutics and biotechnological interventions.,Biotechnol Adv,2017,35,2,178-216,10.1016/j.biotechadv.2016.12.005,,,,,2017-01-01T00:00:00,,,https://ncbi.nlm.nih.gov/pubmed/28043897,"(""Alzheimer Disease""[MeSH Terms] OR alzheimer*[Title/Abstract] OR dementia[Title/Abstract]) AND (technology OR technologies OR wearable* OR sensor* OR ""assistive technolog*"" OR ""smart home"" OR ""digital biomarker*"" OR ""Internet of Things"" OR IoT OR ""machine learning"" OR ""artificial intelligence"" OR AI OR eye-tracking OR ""speech analysis"") AND (2014:2025[dp]) AND humans[MeSH Terms]"
