pmid,pmcid,title,journal,year,volume,issue,pages,doi,authors,first_author,last_author,epubdate,pubdate,mesh,affiliations,url,query
27586863,,Modelling assistive technology adoption for people with dementia.,J Biomed Inform,2016,63,,235-248,10.1016/j.jbi.2016.08.021,,,,,2016-10-01T00:00:00,,,https://ncbi.nlm.nih.gov/pubmed/27586863,"(""Alzheimer Disease""[MeSH Terms] OR alzheimer*[Title/Abstract] OR dementia[Title/Abstract]) AND (technology OR technologies OR wearable* OR sensor* OR ""assistive technolog*"" OR ""smart home"" OR ""digital biomarker*"" OR ""Internet of Things"" OR IoT OR ""machine learning"" OR ""artificial intelligence"" OR AI OR eye-tracking OR ""speech analysis"") AND (2014:2025[dp]) AND humans[MeSH Terms]"
37992921,,Advances in microfluidic chips targeting toxic aggregation proteins for neurodegenerative diseases.,Int J Biol Macromol,2024,256,Pt 2,128308,10.1016/j.ijbiomac.2023.128308,,,,,2024-01-01T00:00:00,,,https://ncbi.nlm.nih.gov/pubmed/37992921,"(""Alzheimer Disease""[MeSH Terms] OR alzheimer*[Title/Abstract] OR dementia[Title/Abstract]) AND (technology OR technologies OR wearable* OR sensor* OR ""assistive technolog*"" OR ""smart home"" OR ""digital biomarker*"" OR ""Internet of Things"" OR IoT OR ""machine learning"" OR ""artificial intelligence"" OR AI OR eye-tracking OR ""speech analysis"") AND (2014:2025[dp]) AND humans[MeSH Terms]"
35887259,,Prognosis of Alzheimer's Disease Using Quantitative Mass Spectrometry of Human Blood Plasma Proteins and Machine Learning.,Int J Mol Sci,2022,23,14,,10.3390/ijms23147907,,,,,2022-07-18T00:00:00,,,https://ncbi.nlm.nih.gov/pubmed/35887259,"(""Alzheimer Disease""[MeSH Terms] OR alzheimer*[Title/Abstract] OR dementia[Title/Abstract]) AND (technology OR technologies OR wearable* OR sensor* OR ""assistive technolog*"" OR ""smart home"" OR ""digital biomarker*"" OR ""Internet of Things"" OR IoT OR ""machine learning"" OR ""artificial intelligence"" OR AI OR eye-tracking OR ""speech analysis"") AND (2014:2025[dp]) AND humans[MeSH Terms]"
35187166,,Blockchain-Based Deep Learning to Process IoT Data Acquisition in Cognitive Data.,Biomed Res Int,2022,2022,,5038851,10.1155/2022/5038851,,,,,2022-01-01T00:00:00,,,https://ncbi.nlm.nih.gov/pubmed/35187166,"(""Alzheimer Disease""[MeSH Terms] OR alzheimer*[Title/Abstract] OR dementia[Title/Abstract]) AND (technology OR technologies OR wearable* OR sensor* OR ""assistive technolog*"" OR ""smart home"" OR ""digital biomarker*"" OR ""Internet of Things"" OR IoT OR ""machine learning"" OR ""artificial intelligence"" OR AI OR eye-tracking OR ""speech analysis"") AND (2014:2025[dp]) AND humans[MeSH Terms]"
36463283,,Graph-based autoencoder integrates spatial transcriptomics with chromatin images and identifies joint biomarkers for Alzheimer's disease.,Nat Commun,2022,13,1,7480,10.1038/s41467-022-35233-1,,,,,2022-12-03T00:00:00,,,https://ncbi.nlm.nih.gov/pubmed/36463283,"(""Alzheimer Disease""[MeSH Terms] OR alzheimer*[Title/Abstract] OR dementia[Title/Abstract]) AND (technology OR technologies OR wearable* OR sensor* OR ""assistive technolog*"" OR ""smart home"" OR ""digital biomarker*"" OR ""Internet of Things"" OR IoT OR ""machine learning"" OR ""artificial intelligence"" OR AI OR eye-tracking OR ""speech analysis"") AND (2014:2025[dp]) AND humans[MeSH Terms]"
29182458,,Multimedia Aided Consent for Alzheimer's Disease Research.,Clin Gerontol,2018,41,1,20-32,10.1080/07317115.2017.1373177,,,,,2018-01-01T00:00:00,,,https://ncbi.nlm.nih.gov/pubmed/29182458,"(""Alzheimer Disease""[MeSH Terms] OR alzheimer*[Title/Abstract] OR dementia[Title/Abstract]) AND (technology OR technologies OR wearable* OR sensor* OR ""assistive technolog*"" OR ""smart home"" OR ""digital biomarker*"" OR ""Internet of Things"" OR IoT OR ""machine learning"" OR ""artificial intelligence"" OR AI OR eye-tracking OR ""speech analysis"") AND (2014:2025[dp]) AND humans[MeSH Terms]"
31375642,,Abnormalities of saccadic eye movements in dementia due to Alzheimer's disease and mild cognitive impairment.,Aging (Albany NY),2019,11,15,5389-5398,10.18632/aging.102118,,,,,2019-08-02T00:00:00,,,https://ncbi.nlm.nih.gov/pubmed/31375642,"(""Alzheimer Disease""[MeSH Terms] OR alzheimer*[Title/Abstract] OR dementia[Title/Abstract]) AND (technology OR technologies OR wearable* OR sensor* OR ""assistive technolog*"" OR ""smart home"" OR ""digital biomarker*"" OR ""Internet of Things"" OR IoT OR ""machine learning"" OR ""artificial intelligence"" OR AI OR eye-tracking OR ""speech analysis"") AND (2014:2025[dp]) AND humans[MeSH Terms]"
36194002,,The use of technology for arts-based activities in older adults living with mild cognitive impairment or dementia: A scoping review.,Dementia (London),2023,22,1,252-280,10.1177/14713012221127359,,,,,2023-01-01T00:00:00,,,https://ncbi.nlm.nih.gov/pubmed/36194002,"(""Alzheimer Disease""[MeSH Terms] OR alzheimer*[Title/Abstract] OR dementia[Title/Abstract]) AND (technology OR technologies OR wearable* OR sensor* OR ""assistive technolog*"" OR ""smart home"" OR ""digital biomarker*"" OR ""Internet of Things"" OR IoT OR ""machine learning"" OR ""artificial intelligence"" OR AI OR eye-tracking OR ""speech analysis"") AND (2014:2025[dp]) AND humans[MeSH Terms]"
35830226,,Implementation of smart supportive dementia technology in a hospital transitional care setting using human-centred design.,Healthc Manage Forum,2022,35,5,318-323,10.1177/08404704221103537,,,,,2022-09-01T00:00:00,,,https://ncbi.nlm.nih.gov/pubmed/35830226,"(""Alzheimer Disease""[MeSH Terms] OR alzheimer*[Title/Abstract] OR dementia[Title/Abstract]) AND (technology OR technologies OR wearable* OR sensor* OR ""assistive technolog*"" OR ""smart home"" OR ""digital biomarker*"" OR ""Internet of Things"" OR IoT OR ""machine learning"" OR ""artificial intelligence"" OR AI OR eye-tracking OR ""speech analysis"") AND (2014:2025[dp]) AND humans[MeSH Terms]"
40383234,,Nanomedicine for targeting brain Neurodegeneration: Critical barriers and circadian rhythm Considerations.,Adv Drug Deliv Rev,2025,222,,115606,10.1016/j.addr.2025.115606,,,,,2025-07-01T00:00:00,,,https://ncbi.nlm.nih.gov/pubmed/40383234,"(""Alzheimer Disease""[MeSH Terms] OR alzheimer*[Title/Abstract] OR dementia[Title/Abstract]) AND (technology OR technologies OR wearable* OR sensor* OR ""assistive technolog*"" OR ""smart home"" OR ""digital biomarker*"" OR ""Internet of Things"" OR IoT OR ""machine learning"" OR ""artificial intelligence"" OR AI OR eye-tracking OR ""speech analysis"") AND (2014:2025[dp]) AND humans[MeSH Terms]"
28574362,,Low-Cost Robotic Assessment of Visuo-Motor Deficits in Alzheimer's Disease.,IEEE Trans Neural Syst Rehabil Eng,2017,25,7,852-860,10.1109/TNSRE.2017.2708715,,,,,2017-07-01T00:00:00,,,https://ncbi.nlm.nih.gov/pubmed/28574362,"(""Alzheimer Disease""[MeSH Terms] OR alzheimer*[Title/Abstract] OR dementia[Title/Abstract]) AND (technology OR technologies OR wearable* OR sensor* OR ""assistive technolog*"" OR ""smart home"" OR ""digital biomarker*"" OR ""Internet of Things"" OR IoT OR ""machine learning"" OR ""artificial intelligence"" OR AI OR eye-tracking OR ""speech analysis"") AND (2014:2025[dp]) AND humans[MeSH Terms]"
27266855,,Direct Tracking of Amyloid and Tu Dynamics in Neuroblastoma Cells Using Nanoplasmonic Fiber Tip Probes.,Nano Lett,2016,16,7,3989-94,10.1021/acs.nanolett.6b00320,,,,,2016-07-13T00:00:00,,,https://ncbi.nlm.nih.gov/pubmed/27266855,"(""Alzheimer Disease""[MeSH Terms] OR alzheimer*[Title/Abstract] OR dementia[Title/Abstract]) AND (technology OR technologies OR wearable* OR sensor* OR ""assistive technolog*"" OR ""smart home"" OR ""digital biomarker*"" OR ""Internet of Things"" OR IoT OR ""machine learning"" OR ""artificial intelligence"" OR AI OR eye-tracking OR ""speech analysis"") AND (2014:2025[dp]) AND humans[MeSH Terms]"
30219036,,Technology-based cognitive training and rehabilitation interventions for individuals with mild cognitive impairment: a systematic review.,BMC Geriatr,2018,18,1,213,10.1186/s12877-018-0893-1,,,,,2018-09-15T00:00:00,,,https://ncbi.nlm.nih.gov/pubmed/30219036,"(""Alzheimer Disease""[MeSH Terms] OR alzheimer*[Title/Abstract] OR dementia[Title/Abstract]) AND (technology OR technologies OR wearable* OR sensor* OR ""assistive technolog*"" OR ""smart home"" OR ""digital biomarker*"" OR ""Internet of Things"" OR IoT OR ""machine learning"" OR ""artificial intelligence"" OR AI OR eye-tracking OR ""speech analysis"") AND (2014:2025[dp]) AND humans[MeSH Terms]"
37557082,,Driving Automation for Older Adults with Preclinical Alzheimer's Disease.,Gerontology,2023,69,11,1307-1314,10.1159/000531263,,,,,2023-01-01T00:00:00,,,https://ncbi.nlm.nih.gov/pubmed/37557082,"(""Alzheimer Disease""[MeSH Terms] OR alzheimer*[Title/Abstract] OR dementia[Title/Abstract]) AND (technology OR technologies OR wearable* OR sensor* OR ""assistive technolog*"" OR ""smart home"" OR ""digital biomarker*"" OR ""Internet of Things"" OR IoT OR ""machine learning"" OR ""artificial intelligence"" OR AI OR eye-tracking OR ""speech analysis"") AND (2014:2025[dp]) AND humans[MeSH Terms]"
33926475,,Nanomedicine-based technologies and novel biomarkers for the diagnosis and treatment of Alzheimer's disease: from current to future challenges.,J Nanobiotechnology,2021,19,1,122,10.1186/s12951-021-00864-x,,,,,2021-04-29T00:00:00,,,https://ncbi.nlm.nih.gov/pubmed/33926475,"(""Alzheimer Disease""[MeSH Terms] OR alzheimer*[Title/Abstract] OR dementia[Title/Abstract]) AND (technology OR technologies OR wearable* OR sensor* OR ""assistive technolog*"" OR ""smart home"" OR ""digital biomarker*"" OR ""Internet of Things"" OR IoT OR ""machine learning"" OR ""artificial intelligence"" OR AI OR eye-tracking OR ""speech analysis"") AND (2014:2025[dp]) AND humans[MeSH Terms]"
38640158,,Eye Tracking During Visual Paired-Comparison Tasks: A Systematic Review and Meta-Analysis of the Diagnostic Test Accuracy for Detecting Cognitive Decline.,J Alzheimers Dis,2024,99,1,207-221,10.3233/JAD-240028,,,,,2024-01-01T00:00:00,,,https://ncbi.nlm.nih.gov/pubmed/38640158,"(""Alzheimer Disease""[MeSH Terms] OR alzheimer*[Title/Abstract] OR dementia[Title/Abstract]) AND (technology OR technologies OR wearable* OR sensor* OR ""assistive technolog*"" OR ""smart home"" OR ""digital biomarker*"" OR ""Internet of Things"" OR IoT OR ""machine learning"" OR ""artificial intelligence"" OR AI OR eye-tracking OR ""speech analysis"") AND (2014:2025[dp]) AND humans[MeSH Terms]"
31948938,,Literature review: technological interventions and their impact on quality of life for people living with dementia.,BMJ Health Care Inform,2020,27,1,,10.1136/bmjhci-2019-100064,,,,,2020-01-01T00:00:00,,,https://ncbi.nlm.nih.gov/pubmed/31948938,"(""Alzheimer Disease""[MeSH Terms] OR alzheimer*[Title/Abstract] OR dementia[Title/Abstract]) AND (technology OR technologies OR wearable* OR sensor* OR ""assistive technolog*"" OR ""smart home"" OR ""digital biomarker*"" OR ""Internet of Things"" OR IoT OR ""machine learning"" OR ""artificial intelligence"" OR AI OR eye-tracking OR ""speech analysis"") AND (2014:2025[dp]) AND humans[MeSH Terms]"
38740448,,Automatic offline-capable smartphone paper-based microfluidic device for efficient biomarker detection of Alzheimer's disease.,Anal Chim Acta,2024,1308,,342575,10.1016/j.aca.2024.342575,,,,,2024-06-15T00:00:00,,,https://ncbi.nlm.nih.gov/pubmed/38740448,"(""Alzheimer Disease""[MeSH Terms] OR alzheimer*[Title/Abstract] OR dementia[Title/Abstract]) AND (technology OR technologies OR wearable* OR sensor* OR ""assistive technolog*"" OR ""smart home"" OR ""digital biomarker*"" OR ""Internet of Things"" OR IoT OR ""machine learning"" OR ""artificial intelligence"" OR AI OR eye-tracking OR ""speech analysis"") AND (2014:2025[dp]) AND humans[MeSH Terms]"
28178858,,Technology-based tools and services for people with dementia and carers: Mapping technology onto the dementia care pathway.,Dementia (London),2019,18,2,725-741,10.1177/1471301217691617,,,,,2019-02-01T00:00:00,,,https://ncbi.nlm.nih.gov/pubmed/28178858,"(""Alzheimer Disease""[MeSH Terms] OR alzheimer*[Title/Abstract] OR dementia[Title/Abstract]) AND (technology OR technologies OR wearable* OR sensor* OR ""assistive technolog*"" OR ""smart home"" OR ""digital biomarker*"" OR ""Internet of Things"" OR IoT OR ""machine learning"" OR ""artificial intelligence"" OR AI OR eye-tracking OR ""speech analysis"") AND (2014:2025[dp]) AND humans[MeSH Terms]"
37740673,,Detecting value(s): Digital biomarkers for Alzheimer's disease and the valuation of new diagnostic technologies.,Sociol Health Illn,2024,46,S1,261-278,10.1111/1467-9566.13713,,,,,2024-03-01T00:00:00,,,https://ncbi.nlm.nih.gov/pubmed/37740673,"(""Alzheimer Disease""[MeSH Terms] OR alzheimer*[Title/Abstract] OR dementia[Title/Abstract]) AND (technology OR technologies OR wearable* OR sensor* OR ""assistive technolog*"" OR ""smart home"" OR ""digital biomarker*"" OR ""Internet of Things"" OR IoT OR ""machine learning"" OR ""artificial intelligence"" OR AI OR eye-tracking OR ""speech analysis"") AND (2014:2025[dp]) AND humans[MeSH Terms]"
37606986,,Key Considerations When Developing and Implementing Digital Technology for Early Detection of Dementia-Causing Diseases Among Health Care Professionals: Qualitative Study.,J Med Internet Res,2023,25,,e46711,10.2196/46711,,,,,2023-08-22T00:00:00,,,https://ncbi.nlm.nih.gov/pubmed/37606986,"(""Alzheimer Disease""[MeSH Terms] OR alzheimer*[Title/Abstract] OR dementia[Title/Abstract]) AND (technology OR technologies OR wearable* OR sensor* OR ""assistive technolog*"" OR ""smart home"" OR ""digital biomarker*"" OR ""Internet of Things"" OR IoT OR ""machine learning"" OR ""artificial intelligence"" OR AI OR eye-tracking OR ""speech analysis"") AND (2014:2025[dp]) AND humans[MeSH Terms]"
40983947,,An AI-first framework for multimodal data in Alzheimer's disease and related dementias.,Alzheimers Dement,2025,21,9,e70719,10.1002/alz.70719,,,,,2025-09-01T00:00:00,,,https://ncbi.nlm.nih.gov/pubmed/40983947,"(""Alzheimer Disease""[MeSH Terms] OR alzheimer*[Title/Abstract] OR dementia[Title/Abstract]) AND (technology OR technologies OR wearable* OR sensor* OR ""assistive technolog*"" OR ""smart home"" OR ""digital biomarker*"" OR ""Internet of Things"" OR IoT OR ""machine learning"" OR ""artificial intelligence"" OR AI OR eye-tracking OR ""speech analysis"") AND (2014:2025[dp]) AND humans[MeSH Terms]"
28351757,,Nanotechnological strategies for nerve growth factor delivery: Therapeutic implications in Alzheimer's disease.,Pharmacol Res,2017,120,,68-87,10.1016/j.phrs.2017.03.020,,,,,2017-06-01T00:00:00,,,https://ncbi.nlm.nih.gov/pubmed/28351757,"(""Alzheimer Disease""[MeSH Terms] OR alzheimer*[Title/Abstract] OR dementia[Title/Abstract]) AND (technology OR technologies OR wearable* OR sensor* OR ""assistive technolog*"" OR ""smart home"" OR ""digital biomarker*"" OR ""Internet of Things"" OR IoT OR ""machine learning"" OR ""artificial intelligence"" OR AI OR eye-tracking OR ""speech analysis"") AND (2014:2025[dp]) AND humans[MeSH Terms]"
29733231,,Recent advancements in the field of nanotechnology for the delivery of anti-Alzheimer drug in the brain region.,Expert Opin Drug Deliv,2018,15,6,589-617,10.1080/17425247.2018.1471058,,,,,2018-06-01T00:00:00,,,https://ncbi.nlm.nih.gov/pubmed/29733231,"(""Alzheimer Disease""[MeSH Terms] OR alzheimer*[Title/Abstract] OR dementia[Title/Abstract]) AND (technology OR technologies OR wearable* OR sensor* OR ""assistive technolog*"" OR ""smart home"" OR ""digital biomarker*"" OR ""Internet of Things"" OR IoT OR ""machine learning"" OR ""artificial intelligence"" OR AI OR eye-tracking OR ""speech analysis"") AND (2014:2025[dp]) AND humans[MeSH Terms]"
33940354,,An automated radiosynthesis of (S)-[18F]28 for PET imaging of Alzheimer's disease.,Appl Radiat Isot,2021,174,,109740,10.1016/j.apradiso.2021.109740,,,,,2021-08-01T00:00:00,,,https://ncbi.nlm.nih.gov/pubmed/33940354,"(""Alzheimer Disease""[MeSH Terms] OR alzheimer*[Title/Abstract] OR dementia[Title/Abstract]) AND (technology OR technologies OR wearable* OR sensor* OR ""assistive technolog*"" OR ""smart home"" OR ""digital biomarker*"" OR ""Internet of Things"" OR IoT OR ""machine learning"" OR ""artificial intelligence"" OR AI OR eye-tracking OR ""speech analysis"") AND (2014:2025[dp]) AND humans[MeSH Terms]"
26035846,,"""Fumbling About with Alzheimer's"": One Disease, Three Women and a Camera.",Gerontologist,2015,55,3,497-9,10.1093/geront/gnv059,,,,,2015-06-01T00:00:00,,,https://ncbi.nlm.nih.gov/pubmed/26035846,"(""Alzheimer Disease""[MeSH Terms] OR alzheimer*[Title/Abstract] OR dementia[Title/Abstract]) AND (technology OR technologies OR wearable* OR sensor* OR ""assistive technolog*"" OR ""smart home"" OR ""digital biomarker*"" OR ""Internet of Things"" OR IoT OR ""machine learning"" OR ""artificial intelligence"" OR AI OR eye-tracking OR ""speech analysis"") AND (2014:2025[dp]) AND humans[MeSH Terms]"
27664357,,[Robotics and improvement of the quality of geriatric care].,Soins Gerontol,2016,21,121,15-17,10.1016/j.sger.2016.07.004,,,,,2016-01-01T00:00:00,,,https://ncbi.nlm.nih.gov/pubmed/27664357,"(""Alzheimer Disease""[MeSH Terms] OR alzheimer*[Title/Abstract] OR dementia[Title/Abstract]) AND (technology OR technologies OR wearable* OR sensor* OR ""assistive technolog*"" OR ""smart home"" OR ""digital biomarker*"" OR ""Internet of Things"" OR IoT OR ""machine learning"" OR ""artificial intelligence"" OR AI OR eye-tracking OR ""speech analysis"") AND (2014:2025[dp]) AND humans[MeSH Terms]"
37459647,,A critical review on the role of nanotheranostics mediated approaches for targeting β amyloid in Alzheimer's.,J Drug Target,2023,31,7,725-744,10.1080/1061186X.2023.2238250,,,,,2023-08-01T00:00:00,,,https://ncbi.nlm.nih.gov/pubmed/37459647,"(""Alzheimer Disease""[MeSH Terms] OR alzheimer*[Title/Abstract] OR dementia[Title/Abstract]) AND (technology OR technologies OR wearable* OR sensor* OR ""assistive technolog*"" OR ""smart home"" OR ""digital biomarker*"" OR ""Internet of Things"" OR IoT OR ""machine learning"" OR ""artificial intelligence"" OR AI OR eye-tracking OR ""speech analysis"") AND (2014:2025[dp]) AND humans[MeSH Terms]"
37124775,,Engaging older adults with a migration background to explore the usage of digital technologies in coping with dementia.,Front Public Health,2023,11,,1125834,10.3389/fpubh.2023.1125834,,,,,2023-01-01T00:00:00,,,https://ncbi.nlm.nih.gov/pubmed/37124775,"(""Alzheimer Disease""[MeSH Terms] OR alzheimer*[Title/Abstract] OR dementia[Title/Abstract]) AND (technology OR technologies OR wearable* OR sensor* OR ""assistive technolog*"" OR ""smart home"" OR ""digital biomarker*"" OR ""Internet of Things"" OR IoT OR ""machine learning"" OR ""artificial intelligence"" OR AI OR eye-tracking OR ""speech analysis"") AND (2014:2025[dp]) AND humans[MeSH Terms]"
34128574,,Digital reminiscence app co-created by people living with dementia and carers: Usability and eye gaze analysis.,Health Expect,2021,24,4,1207-1219,10.1111/hex.13251,,,,,2021-08-01T00:00:00,,,https://ncbi.nlm.nih.gov/pubmed/34128574,"(""Alzheimer Disease""[MeSH Terms] OR alzheimer*[Title/Abstract] OR dementia[Title/Abstract]) AND (technology OR technologies OR wearable* OR sensor* OR ""assistive technolog*"" OR ""smart home"" OR ""digital biomarker*"" OR ""Internet of Things"" OR IoT OR ""machine learning"" OR ""artificial intelligence"" OR AI OR eye-tracking OR ""speech analysis"") AND (2014:2025[dp]) AND humans[MeSH Terms]"
26243074,,Patterns of Innovation in Alzheimer's Disease Drug Development: A Strategic Assessment Based on Technological Maturity.,Clin Ther,2015,37,8,1643-51.e3,10.1016/j.clinthera.2015.07.003,,,,,2015-08-01T00:00:00,,,https://ncbi.nlm.nih.gov/pubmed/26243074,"(""Alzheimer Disease""[MeSH Terms] OR alzheimer*[Title/Abstract] OR dementia[Title/Abstract]) AND (technology OR technologies OR wearable* OR sensor* OR ""assistive technolog*"" OR ""smart home"" OR ""digital biomarker*"" OR ""Internet of Things"" OR IoT OR ""machine learning"" OR ""artificial intelligence"" OR AI OR eye-tracking OR ""speech analysis"") AND (2014:2025[dp]) AND humans[MeSH Terms]"
31866505,,"Receptor specific, stimuli responsive and subcellular targeted approaches for effective therapy of Alzheimer: Role of surface engineered nanocarriers.",J Control Release,2020,319,,183-200,10.1016/j.jconrel.2019.12.034,,,,,2020-03-10T00:00:00,,,https://ncbi.nlm.nih.gov/pubmed/31866505,"(""Alzheimer Disease""[MeSH Terms] OR alzheimer*[Title/Abstract] OR dementia[Title/Abstract]) AND (technology OR technologies OR wearable* OR sensor* OR ""assistive technolog*"" OR ""smart home"" OR ""digital biomarker*"" OR ""Internet of Things"" OR IoT OR ""machine learning"" OR ""artificial intelligence"" OR AI OR eye-tracking OR ""speech analysis"") AND (2014:2025[dp]) AND humans[MeSH Terms]"
28605073,,Antibody-Mimetic Peptoid Nanosheet for Label-Free Serum-Based Diagnosis of Alzheimer's Disease.,Adv Mater,2017,29,30,,10.1002/adma.201700057,,,,,2017-08-01T00:00:00,,,https://ncbi.nlm.nih.gov/pubmed/28605073,"(""Alzheimer Disease""[MeSH Terms] OR alzheimer*[Title/Abstract] OR dementia[Title/Abstract]) AND (technology OR technologies OR wearable* OR sensor* OR ""assistive technolog*"" OR ""smart home"" OR ""digital biomarker*"" OR ""Internet of Things"" OR IoT OR ""machine learning"" OR ""artificial intelligence"" OR AI OR eye-tracking OR ""speech analysis"") AND (2014:2025[dp]) AND humans[MeSH Terms]"
28482786,,Nanotechnology Based Theranostic Approaches in Alzheimer's Disease Management: Current Status and Future Perspective.,Curr Alzheimer Res,2017,14,11,1164-1181,10.2174/1567205014666170508121031,,,,,2017-01-01T00:00:00,,,https://ncbi.nlm.nih.gov/pubmed/28482786,"(""Alzheimer Disease""[MeSH Terms] OR alzheimer*[Title/Abstract] OR dementia[Title/Abstract]) AND (technology OR technologies OR wearable* OR sensor* OR ""assistive technolog*"" OR ""smart home"" OR ""digital biomarker*"" OR ""Internet of Things"" OR IoT OR ""machine learning"" OR ""artificial intelligence"" OR AI OR eye-tracking OR ""speech analysis"") AND (2014:2025[dp]) AND humans[MeSH Terms]"
34148547,,Digital technologies to support people living with dementia in the care home setting to engage in meaningful occupations: protocol for a scoping review.,Syst Rev,2021,10,1,179,10.1186/s13643-021-01715-4,,,,,2021-06-21T00:00:00,,,https://ncbi.nlm.nih.gov/pubmed/34148547,"(""Alzheimer Disease""[MeSH Terms] OR alzheimer*[Title/Abstract] OR dementia[Title/Abstract]) AND (technology OR technologies OR wearable* OR sensor* OR ""assistive technolog*"" OR ""smart home"" OR ""digital biomarker*"" OR ""Internet of Things"" OR IoT OR ""machine learning"" OR ""artificial intelligence"" OR AI OR eye-tracking OR ""speech analysis"") AND (2014:2025[dp]) AND humans[MeSH Terms]"
38219225,,Digital technologies to prevent falls in people living with dementia or mild cognitive impairment: a rapid systematic overview of systematic reviews.,Age Ageing,2024,53,1,,10.1093/ageing/afad238,,,,,2024-01-02T00:00:00,,,https://ncbi.nlm.nih.gov/pubmed/38219225,"(""Alzheimer Disease""[MeSH Terms] OR alzheimer*[Title/Abstract] OR dementia[Title/Abstract]) AND (technology OR technologies OR wearable* OR sensor* OR ""assistive technolog*"" OR ""smart home"" OR ""digital biomarker*"" OR ""Internet of Things"" OR IoT OR ""machine learning"" OR ""artificial intelligence"" OR AI OR eye-tracking OR ""speech analysis"") AND (2014:2025[dp]) AND humans[MeSH Terms]"
33928806,,Executive function deficits in mild cognitive impairment: evidence from saccade tasks.,Aging Ment Health,2022,26,5,1001-1009,10.1080/13607863.2021.1913471,,,,,2022-05-01T00:00:00,,,https://ncbi.nlm.nih.gov/pubmed/33928806,"(""Alzheimer Disease""[MeSH Terms] OR alzheimer*[Title/Abstract] OR dementia[Title/Abstract]) AND (technology OR technologies OR wearable* OR sensor* OR ""assistive technolog*"" OR ""smart home"" OR ""digital biomarker*"" OR ""Internet of Things"" OR IoT OR ""machine learning"" OR ""artificial intelligence"" OR AI OR eye-tracking OR ""speech analysis"") AND (2014:2025[dp]) AND humans[MeSH Terms]"
36203322,,Partnering with people living with dementia and care partners in technology research and design: Reflections and recommendations.,Aust Occup Ther J,2022,69,6,723-741,10.1111/1440-1630.12843,,,,,2022-12-01T00:00:00,,,https://ncbi.nlm.nih.gov/pubmed/36203322,"(""Alzheimer Disease""[MeSH Terms] OR alzheimer*[Title/Abstract] OR dementia[Title/Abstract]) AND (technology OR technologies OR wearable* OR sensor* OR ""assistive technolog*"" OR ""smart home"" OR ""digital biomarker*"" OR ""Internet of Things"" OR IoT OR ""machine learning"" OR ""artificial intelligence"" OR AI OR eye-tracking OR ""speech analysis"") AND (2014:2025[dp]) AND humans[MeSH Terms]"
37115257,,[Mobile everyday-life digital technologies for the prevention of Alzheimer's dementia: cognitive health and cognitive safety].,Nervenarzt,2023,94,5,400-407,10.1007/s00115-023-01478-4,,,,,2023-05-01T00:00:00,,,https://ncbi.nlm.nih.gov/pubmed/37115257,"(""Alzheimer Disease""[MeSH Terms] OR alzheimer*[Title/Abstract] OR dementia[Title/Abstract]) AND (technology OR technologies OR wearable* OR sensor* OR ""assistive technolog*"" OR ""smart home"" OR ""digital biomarker*"" OR ""Internet of Things"" OR IoT OR ""machine learning"" OR ""artificial intelligence"" OR AI OR eye-tracking OR ""speech analysis"") AND (2014:2025[dp]) AND humans[MeSH Terms]"
